Title,Job Zone,Description,Domain,O*NET-SOC Code,spanish_title,spanish_description,spanish_domain
Dental Hygienists,3,Administer oral hygiene care to patients. Assess patient oral hygiene problems or needs and maintain health records. Advise patients on oral health maintenance and disease prevention. May provide advanced care such as providing fluoride treatment or administering topical anesthesia.,Healthcare Practitioners and Technical Occupations,29-1292.00,Higienistas dentales,"Administrar atención de higiene oral a los pacientes. Evaluar los problemas o las necesidades de la higiene bucal del paciente y mantener registros de salud. Asesorar a los pacientes sobre el mantenimiento de la salud bucal y la prevención de enfermedades. Puede proporcionar atención avanzada, como proporcionar tratamiento con fluoruro o administrar anestesia tópica.",Profesionales de la salud y ocupaciones técnicas
Naturopathic Physicians,5,"Diagnose, treat, and help prevent diseases using a system of practice that is based on the natural healing capacity of individuals. May use physiological, psychological or mechanical methods. May also use natural medicines, prescription or legend drugs, foods, herbs, or other natural remedies.",Healthcare Practitioners and Technical Occupations,29-1299.01,Médicos naturópatas,"Diagnosticar, tratar y ayudar a prevenir enfermedades utilizando un sistema de práctica que se basa en la capacidad de curación natural de los individuos. Puede usar métodos fisiológicos, psicológicos o mecánicos. También puede usar medicamentos naturales, medicamentos recetados o de leyenda, alimentos, hierbas u otros remedios naturales.",Profesionales de la salud y ocupaciones técnicas
Orthoptists,5,Diagnose and treat visual system disorders such as binocular vision and eye movement impairments.,Healthcare Practitioners and Technical Occupations,29-1299.02,Ortoptistas,"Diagnosticar y tratar los trastornos del sistema visual, como la visión binocular y las alteraciones del movimiento ocular.",Profesionales de la salud y ocupaciones técnicas
Medical and Clinical Laboratory Technologists,4,"Perform complex medical laboratory tests for diagnosis, treatment, and prevention of disease. May train or supervise staff.",Healthcare Practitioners and Technical Occupations,29-2011.00,Tecnólogos de laboratorio médico y clínico,"Realice pruebas de laboratorio médico complejos para el diagnóstico, el tratamiento y la prevención de la enfermedad. Puede capacitar o supervisar al personal.",Profesionales de la salud y ocupaciones técnicas
Cytogenetic Technologists,4,"Analyze chromosomes or chromosome segments found in biological specimens, such as amniotic fluids, bone marrow, solid tumors, and blood to aid in the study, diagnosis, classification, or treatment of inherited or acquired genetic diseases. Conduct analyses through classical cytogenetic, fluorescent in situ hybridization (FISH) or array comparative genome hybridization (aCGH) techniques.",Healthcare Practitioners and Technical Occupations,29-2011.01,Tecnólogos citogenéticos,"Analice los cromosomas o segmentos de cromosomas encontrados en muestras biológicas, como fluidos amnióticos, médula ósea, tumores sólidos y sangre para ayudar en el estudio, diagnóstico, clasificación o tratamiento de enfermedades genéticas heredadas o adquiridas. Realice análisis a través de técnicas citogenéticas clásicas, fluorescentes in situ (FISH) o de hibridación del genoma comparativo de matriz (ACGH).",Profesionales de la salud y ocupaciones técnicas
Cytotechnologists,5,"Stain, mount, and study cells to detect evidence of cancer, hormonal abnormalities, and other pathological conditions following established standards and practices.",Healthcare Practitioners and Technical Occupations,29-2011.02,Citotecnólogos,"Manchas, de montaje y estudio de células para detectar evidencia de cáncer, anomalías hormonales y otras afecciones patológicas después de los estándares y prácticas establecidas.",Profesionales de la salud y ocupaciones técnicas
Histotechnologists,4,Apply knowledge of health and disease causes to evaluate new laboratory techniques and procedures to examine tissue samples. Process and prepare histological slides from tissue sections for microscopic examination and diagnosis by pathologists. May solve technical or instrument problems or assist with research studies.,Healthcare Practitioners and Technical Occupations,29-2011.04,Histotecnólogos,Aplicar el conocimiento de las causas de salud y enfermedades para evaluar nuevas técnicas y procedimientos de laboratorio para examinar las muestras de tejidos. Procese y prepare los portaobjetos histológicos de las secciones de tejido para el examen microscópico y el diagnóstico por los patólogos. Puede resolver problemas técnicos o de instrumentos o ayudar con los estudios de investigación.,Profesionales de la salud y ocupaciones técnicas
Medical and Clinical Laboratory Technicians,3,"Perform routine medical laboratory tests for the diagnosis, treatment, and prevention of disease. May work under the supervision of a medical technologist.",Healthcare Practitioners and Technical Occupations,29-2012.00,Técnicos de laboratorio médico y clínico,"Realice pruebas de laboratorio médico de rutina para el diagnóstico, tratamiento y prevención de enfermedades. Puede trabajar bajo la supervisión de un tecnólogo médico.",Profesionales de la salud y ocupaciones técnicas
Histology Technicians,3,Prepare histological slides from tissue sections for microscopic examination and diagnosis by pathologists. May assist with research studies.,Healthcare Practitioners and Technical Occupations,29-2012.01,Técnicos de histología,Prepare los portaobjetos histológicos de las secciones de tejido para el examen y el diagnóstico microscópicos por los patólogos. Puede ayudar con los estudios de investigación.,Profesionales de la salud y ocupaciones técnicas
Cardiovascular Technologists and Technicians,3,"Conduct tests on pulmonary or cardiovascular systems of patients for diagnostic, therapeutic, or research purposes. May conduct or assist in electrocardiograms, cardiac catheterizations, pulmonary functions, lung capacity, and similar tests.",Healthcare Practitioners and Technical Occupations,29-2031.00,Tecnólogos y técnicos cardiovasculares,"Realice pruebas sobre sistemas pulmonares o cardiovasculares de pacientes con fines de diagnóstico, terapéuticos o de investigación. Puede realizar o ayudar en electrocardiogramas, cateterizaciones cardíacas, funciones pulmonares, capacidad pulmonar y pruebas similares.",Profesionales de la salud y ocupaciones técnicas
Diagnostic Medical Sonographers,3,Produce ultrasonic recordings of internal organs for use by physicians. Includes vascular technologists.,Healthcare Practitioners and Technical Occupations,29-2032.00,Ecogonógrafos de diagnóstico,Producir grabaciones ultrasónicas de órganos internos para su uso por parte de los médicos. Incluye tecnólogos vasculares.,Profesionales de la salud y ocupaciones técnicas
Nuclear Medicine Technologists,3,"Prepare, administer, and measure radioactive isotopes in therapeutic, diagnostic, and tracer studies using a variety of radioisotope equipment. Prepare stock solutions of radioactive materials and calculate doses to be administered by radiologists. Subject patients to radiation. Execute blood volume, red cell survival, and fat absorption studies following standard laboratory techniques.",Healthcare Practitioners and Technical Occupations,29-2033.00,Tecnólogos de medicina nuclear,"Prepare, administre y mida isótopos radiactivos en estudios terapéuticos, diagnósticos y trazadores utilizando una variedad de equipos de radioisótopos. Prepare soluciones stock de materiales radiactivos y calcule las dosis que los radiólogos administrarán. Pacientes sujetos a radiación. Ejecutar el volumen sanguíneo, la supervivencia de los glóbulos rojos y los estudios de absorción de grasas después de técnicas de laboratorio estándar.",Profesionales de la salud y ocupaciones técnicas
Radiologic Technologists and Technicians,3,Take x-rays and CAT scans or administer nonradioactive materials into patient's bloodstream for diagnostic or research purposes. Includes radiologic technologists and technicians who specialize in other scanning modalities.,Healthcare Practitioners and Technical Occupations,29-2034.00,Tecnólogos y técnicos radiológicos,Tome radiografías y escaneos CAT o administre materiales no radiactivos en el torrente sanguíneo del paciente con fines de diagnóstico o de investigación. Incluye tecnólogos radiológicos y técnicos que se especializan en otras modalidades de escaneo.,Profesionales de la salud y ocupaciones técnicas
Magnetic Resonance Imaging Technologists,3,"Operate Magnetic Resonance Imaging (MRI) scanners. Monitor patient safety and comfort, and view images of area being scanned to ensure quality of pictures. May administer gadolinium contrast dosage intravenously. May interview patient, explain MRI procedures, and position patient on examining table. May enter into the computer data such as patient history, anatomical area to be scanned, orientation specified, and position of entry.",Healthcare Practitioners and Technical Occupations,29-2035.00,Tecnólogos de resonancia magnética,"Operar escáneres de resonancia magnética (MRI). Monitoree la seguridad y la comodidad del paciente, y vea las imágenes del área que se escanea para garantizar la calidad de las imágenes. Puede administrar la dosis de contraste de gadolinio por vía intravenosa. Puede entrevistar al paciente, explicar los procedimientos de resonancia magnética y posicionar al paciente en la tabla de examen. Puede ingresar a los datos de la computadora, como el historial de pacientes, el área anatómica que se escanea, la orientación especificada y la posición de entrada.",Profesionales de la salud y ocupaciones técnicas
Medical Dosimetrists,3,"Generate radiation treatment plans, develop radiation dose calculations, communicate and supervise the treatment plan implementation, and consult with members of radiation oncology team.",Healthcare Practitioners and Technical Occupations,29-2036.00,Dosimetristas médicos,"Genere planes de tratamiento de radiación, desarrolle cálculos de dosis de radiación, comunique y supervise la implementación del plan de tratamiento y consulte con los miembros del equipo de oncología de la radiación.",Profesionales de la salud y ocupaciones técnicas
Emergency Medical Technicians,3,Assess injuries and illnesses and administer basic emergency medical care. May transport injured or sick persons to medical facilities.,Healthcare Practitioners and Technical Occupations,29-2042.00,Técnicos médicos de emergencia,Evaluar las lesiones y enfermedades y administrar atención médica de emergencia básica. Puede transportar personas heridas o enfermas a instalaciones médicas.,Profesionales de la salud y ocupaciones técnicas
Paramedics,3,"Administer basic or advanced emergency medical care and assess injuries and illnesses. May administer medication intravenously, use equipment such as EKGs, or administer advanced life support to sick or injured individuals.",Healthcare Practitioners and Technical Occupations,29-2043.00,Paramédicos,"Administre atención médica de emergencia básica o avanzada y evalúe lesiones y enfermedades. Puede administrar medicamentos por vía intravenosa, usar equipos como EKG o administrar soporte vital avanzado a individuos enfermos o lesionados.",Profesionales de la salud y ocupaciones técnicas
Dietetic Technicians,3,"Assist in the provision of food service and nutritional programs, under the supervision of a dietitian. May plan and produce meals based on established guidelines, teach principles of food and nutrition, or counsel individuals.",Healthcare Practitioners and Technical Occupations,29-2051.00,Técnicos dietéticos,"Asistir en la provisión de servicios de servicio y programas nutricionales, bajo la supervisión de un dietista. Puede planificar y producir comidas basadas en pautas establecidas, principios de enseñanza de alimentos y nutrición, o asesorar a las personas.",Profesionales de la salud y ocupaciones técnicas
Pharmacy Technicians,3,"Prepare medications under the direction of a pharmacist. May measure, mix, count out, label, and record amounts and dosages of medications according to prescription orders.",Healthcare Practitioners and Technical Occupations,29-2052.00,Técnicos de farmacia,"Prepare medicamentos bajo la dirección de un farmacéutico. Puede medir, mezclar, contar, etiquetar y registrar cantidades y dosis de medicamentos de acuerdo con las órdenes de receta.",Profesionales de la salud y ocupaciones técnicas
Psychiatric Technicians,3,"Care for individuals with mental or emotional conditions or disabilities, following the instructions of physicians or other health practitioners. Monitor patients' physical and emotional well-being and report to medical staff. May participate in rehabilitation and treatment programs, help with personal hygiene, and administer oral or injectable medications.",Healthcare Practitioners and Technical Occupations,29-2053.00,Técnicos psiquiátricos,"Cuidar a las personas con condiciones o discapacidades mentales o emocionales, siguiendo las instrucciones de los médicos u otros profesionales de la salud. Monitoree el bienestar físico y emocional de los pacientes e informe al personal médico. Puede participar en programas de rehabilitación y tratamiento, ayudar con la higiene personal y administrar medicamentos orales o inyectables.",Profesionales de la salud y ocupaciones técnicas
Surgical Technologists,3,"Assist in operations, under the supervision of surgeons, registered nurses, or other surgical personnel. May help set up operating room, prepare and transport patients for surgery, adjust lights and equipment, pass instruments and other supplies to surgeons and surgeons' assistants, hold retractors, cut sutures, and help count sponges, needles, supplies, and instruments.",Healthcare Practitioners and Technical Occupations,29-2055.00,Tecnólogos quirúrgicos,"Asistir en operaciones, bajo la supervisión de cirujanos, enfermeras registradas u otro personal quirúrgico. Puede ayudar a establecer un quirófano, preparar y transportar pacientes para cirugía, ajustar luces y equipos, pasar instrumentos y otros suministros a los cirujanos y asistentes de cirujanos, retener retractores, cortar suturas y ayudar a contar esponjas, agujas, suministros e instrumentos.",Profesionales de la salud y ocupaciones técnicas
Veterinary Technologists and Technicians,3,"Perform medical tests in a laboratory environment for use in the treatment and diagnosis of diseases in animals. Prepare vaccines and serums for prevention of diseases. Prepare tissue samples, take blood samples, and execute laboratory tests, such as urinalysis and blood counts. Clean and sterilize instruments and materials and maintain equipment and machines. May assist a veterinarian during surgery.",Healthcare Practitioners and Technical Occupations,29-2056.00,Tecnólogos y técnicos veterinarios,"Realice pruebas médicas en un entorno de laboratorio para su uso en el tratamiento y diagnóstico de enfermedades en los animales. Prepare vacunas y sueros para la prevención de enfermedades. Prepare muestras de tejido, tome muestras de sangre y ejecute pruebas de laboratorio, como análisis de orina y recuentos sanguíneos. Limpie y esterilice instrumentos y materiales y mantenga equipos y máquinas. Puede ayudar a un veterinario durante la cirugía.",Profesionales de la salud y ocupaciones técnicas
Ophthalmic Medical Technicians,3,"Assist ophthalmologists by performing ophthalmic clinical functions. May administer eye exams, administer eye medications, and instruct the patient in care and use of corrective lenses.",Healthcare Practitioners and Technical Occupations,29-2057.00,Técnicos médicos oftálmicos,"Ayude a los oftalmólogos realizando funciones clínicas oftálmicas. Puede administrar exámenes oculares, administrar medicamentos para los ojos e instruir al paciente en la atención y el uso de lentes correctivas.",Profesionales de la salud y ocupaciones técnicas
Licensed Practical and Licensed Vocational Nurses,3,"Care for ill, injured, or convalescing patients or persons with disabilities in hospitals, nursing homes, clinics, private homes, group homes, and similar institutions. May work under the supervision of a registered nurse. Licensing required.",Healthcare Practitioners and Technical Occupations,29-2061.00,Enfermeras vocacionales prácticas y con licencia con licencia,"Atención a pacientes o personas o personas con discapacidades enfermas, lesionadas o convalecientes en hospitales, hogares de ancianos, clínicas, hogares privados, hogares grupales e instituciones similares. Puede trabajar bajo la supervisión de una enfermera registrada. Se requieren licencias.",Profesionales de la salud y ocupaciones técnicas
Medical Records Specialists,3,"Compile, process, and maintain medical records of hospital and clinic patients in a manner consistent with medical, administrative, ethical, legal, and regulatory requirements of the healthcare system. Classify medical and healthcare concepts, including diagnosis, procedures, medical services, and equipment, into the healthcare industry's numerical coding system. Includes medical coders.",Healthcare Practitioners and Technical Occupations,29-2072.00,Especialistas en registros médicos,"Compile, procese y mantenga registros médicos de pacientes hospitalarios y clínicos de manera consistente con los requisitos médicos, administrativos, éticos, legales y reglamentarios del sistema de salud. Clasifique los conceptos médicos y de atención médica, incluidos el diagnóstico, los procedimientos, los servicios médicos y el equipo, en el sistema de codificación numérica de la industria de la salud. Incluye codificadores médicos.",Profesionales de la salud y ocupaciones técnicas
"Opticians, Dispensing",3,"Design, measure, fit, and adapt lenses and frames for client according to written optical prescription or specification. Assist client with inserting, removing, and caring for contact lenses. Assist client with selecting frames. Measure customer for size of eyeglasses and coordinate frames with facial and eye measurements and optical prescription. Prepare work order for optical laboratory containing instructions for grinding and mounting lenses in frames. Verify exactness of finished lens spectacles. Adjust frame and lens position to fit client. May shape or reshape frames. Includes contact lens opticians.",Healthcare Practitioners and Technical Occupations,29-2081.00,"Ópticos, dispensando","Diseñar, medir, ajustar y adaptar lentes y marcos para el cliente de acuerdo con la prescripción óptica o especificación escrita. Ayude al cliente a insertar, eliminar y cuidar las lentes de contacto. Ayude al cliente a seleccionar marcos. Mida al cliente para el tamaño de los anteojos y los marcos de coordinación con mediciones faciales y oculares y receta óptica. Prepare la orden de trabajo para el laboratorio óptico que contiene instrucciones para molienda y lentes de montaje en marcos. Verifique la exactitud de las gafas de lente terminada. Ajuste la posición de marco y lente para adaptarse al cliente. Puede dar forma o remodelar los marcos. Incluye lentes de contacto ópticos.",Profesionales de la salud y ocupaciones técnicas
Orthotists and Prosthetists,5,"Design, measure, fit, and adapt orthopedic braces, appliances or prostheses, such as limbs or facial parts for patients with disabling conditions.",Healthcare Practitioners and Technical Occupations,29-2091.00,Ortotistas y prótesis,"Diseñar, medir, ajustar y adaptar aparatos ortopédicos, electrodomésticos o prótesis, como extremidades o piezas faciales para pacientes con afecciones incapacitantes.",Profesionales de la salud y ocupaciones técnicas
Hearing Aid Specialists,3,"Select and fit hearing aids for customers. Administer and interpret tests of hearing. Assess hearing instrument efficacy. Take ear impressions and prepare, design, and modify ear molds.",Healthcare Practitioners and Technical Occupations,29-2092.00,Especialistas en audífonos,"Seleccione y se ajuste a los audífonos para los clientes. Administrar e interpretar pruebas de audición. Evaluar la eficacia del instrumento auditivo. Tome las impresiones de los oídos y prepare, diseñe y modifique los moldes para los oídos.",Profesionales de la salud y ocupaciones técnicas
Neurodiagnostic Technologists,3,"Conduct electroneurodiagnostic (END) tests such as electroencephalograms, evoked potentials, polysomnograms, or electronystagmograms. May perform nerve conduction studies.",Healthcare Practitioners and Technical Occupations,29-2099.01,Tecnólogos neurodiagnósticos,"Realizar pruebas electroneurodiagnósticas (finales) como electroencefalogramas, potenciales evocados, polisomnogramas o electronystagmogramas. Puede realizar estudios de conducción nerviosa.",Profesionales de la salud y ocupaciones técnicas
Ophthalmic Medical Technologists,3,"Assist ophthalmologists by performing ophthalmic clinical functions and ophthalmic photography. Provide instruction and supervision to other ophthalmic personnel. Assist with minor surgical procedures, applying aseptic techniques and preparing instruments. May perform eye exams, administer eye medications, and instruct patients in care and use of corrective lenses.",Healthcare Practitioners and Technical Occupations,29-2099.05,Tecnólogos médicos oftálmicos,"Ayude a los oftalmólogos realizando funciones clínicas oftálmicas y fotografía oftálmica. Proporcione instrucción y supervisión a otro personal oftálmico. Asistir con procedimientos quirúrgicos menores, aplicar técnicas asépticas y preparar instrumentos. Puede realizar exámenes oculares, administrar medicamentos para los ojos e instruir a los pacientes en la atención y el uso de lentes correctivas.",Profesionales de la salud y ocupaciones técnicas
Patient Representatives,3,"Assist patients in obtaining services, understanding policies and making health care decisions.",Healthcare Practitioners and Technical Occupations,29-2099.08,Representantes de pacientes,"Ayudar a los pacientes a obtener servicios, comprender las políticas y tomar decisiones de atención médica.",Profesionales de la salud y ocupaciones técnicas
Health Information Technologists and Medical Registrars,3,"Apply knowledge of healthcare and information systems to assist in the design, development, and continued modification and analysis of computerized healthcare systems. Abstract, collect, and analyze treatment and followup information of patients. May educate staff and assist in problem solving to promote the implementation of the healthcare information system. May design, develop, test, and implement databases with complete history, diagnosis, treatment, and health status to help monitor diseases.",Healthcare Practitioners and Technical Occupations,29-9021.00,Tecnólogos de la información de salud y registradores médicos,"Aplique el conocimiento de los sistemas de atención médica y de información para ayudar en el diseño, el desarrollo y la modificación y el análisis continuos de los sistemas de salud computarizados. Resumen, recopila y analiza el tratamiento y la información de seguimiento de los pacientes. Puede educar al personal y ayudar en la resolución de problemas para promover la implementación del sistema de información de atención médica. Puede diseñar, desarrollar, probar e implementar bases de datos con historial completo, diagnóstico, tratamiento y estado de salud para ayudar a monitorear las enfermedades.",Profesionales de la salud y ocupaciones técnicas
Athletic Trainers,5,"Evaluate and treat musculoskeletal injuries or illnesses. Provide preventive, therapeutic, emergency, and rehabilitative care.",Healthcare Practitioners and Technical Occupations,29-9091.00,Entrenadores de atletismo,"Evaluar y tratar lesiones o enfermedades musculoesqueléticas. Proporcione atención preventiva, terapéutica, de emergencia y rehabilitativa.",Profesionales de la salud y ocupaciones técnicas
Genetic Counselors,5,"Assess individual or family risk for a variety of inherited conditions, such as genetic disorders and birth defects. Provide information to other healthcare providers or to individuals and families concerned with the risk of inherited conditions. Advise individuals and families to support informed decisionmaking and coping methods for those at risk. May help conduct research related to genetic conditions or genetic counseling.",Healthcare Practitioners and Technical Occupations,29-9092.00,Asesores genéticos,"Evaluar el riesgo individual o familiar de una variedad de afecciones hereditarias, como trastornos genéticos y defectos de nacimiento. Proporcione información a otros proveedores de atención médica o a personas y familias relacionadas con el riesgo de afecciones hereditarias. Aconsejar a las personas y las familias que apoyen los métodos informados de toma de decisiones y afrontamiento para aquellos en riesgo. Puede ayudar a realizar investigaciones relacionadas con condiciones genéticas o asesoramiento genético.",Profesionales de la salud y ocupaciones técnicas
