Title,Job Zone,Description,Domain,O*NET-SOC Code,spanish_title,spanish_description,spanish_domain
Postal Service Clerks,2,"Perform any combination of tasks in a United States Postal Service (USPS) post office, such as receive letters and parcels; sell postage and revenue stamps, postal cards, and stamped envelopes; fill out and sell money orders; place mail in pigeon holes of mail rack or in bags; and examine mail for correct postage. Includes postal service clerks employed by USPS contractors.",Office and Administrative Support Occupations,43-5051.00,Empleados de servicio postal,"Realice cualquier combinación de tareas en una oficina de correos del Servicio Postal de los Estados Unidos (USPS), como recibir cartas y parcelas; Vender franqueo e sellos de ingresos, tarjetas postales y sobres estampados; completar y vender giros monetarios; Coloque el correo en agujeros de paloma de estante de correo o en bolsas; y examine el correo para obtener el franqueo correcto. Incluye empleados de servicio postal empleados por contratistas de USPS.",Office y ocupaciones de apoyo administrativo
Postal Service Mail Carriers,2,Sort and deliver mail for the United States Postal Service (USPS). Deliver mail on established route by vehicle or on foot. Includes postal service mail carriers employed by USPS contractors.,Office and Administrative Support Occupations,43-5052.00,Servicio postal Carriers,Ordene y entregue el correo para el Servicio Postal de los Estados Unidos (USPS). Entregue el correo en la ruta establecida por vehículo o a pie. Incluye Correos de Servicio Postal empleados por contratistas de USPS.,Office y ocupaciones de apoyo administrativo
"Postal Service Mail Sorters, Processors, and Processing Machine Operators",2,"Prepare incoming and outgoing mail for distribution for the United States Postal Service (USPS). Examine, sort, and route mail. Load, operate, and occasionally adjust and repair mail processing, sorting, and canceling machinery. Keep records of shipments, pouches, and sacks, and perform other duties related to mail handling within the postal service. Includes postal service mail sorters and processors employed by USPS contractors.",Office and Administrative Support Occupations,43-5053.00,"Clasificadores de correo postal, procesadores y operadores de máquinas de procesamiento","Prepare el correo entrante y saliente para su distribución para el Servicio Postal de los Estados Unidos (USPS). Examinar, clasificar y enrutar el correo. Cargue, opere y ocasionalmente ajuste y repare el procesamiento de correo, clasificación y cancelación de maquinaria. Mantenga registros de envíos, bolsas y capturas, y realice otras tareas relacionadas con el manejo del correo dentro del servicio postal. Incluye clasificadores de correo postal y procesadores empleados por contratistas de USPS.",Office y ocupaciones de apoyo administrativo
"Production, Planning, and Expediting Clerks",2,"Coordinate and expedite the flow of work and materials within or between departments of an establishment according to production schedule. Duties include reviewing and distributing production, work, and shipment schedules; conferring with department supervisors to determine progress of work and completion dates; and compiling reports on progress of work, inventory levels, costs, and production problems.",Office and Administrative Support Occupations,43-5061.00,"Empleados de producción, planificación y aceleración","Coordinar y acelerar el flujo de trabajo y materiales dentro o entre los departamentos de un establecimiento de acuerdo con el cronograma de producción. Las tareas incluyen revisar y distribuir la producción, el trabajo y los horarios de envío; Conferir con los supervisores del departamento para determinar el progreso del trabajo y las fechas de finalización; y compilar informes sobre el progreso del trabajo, los niveles de inventario, los costos y los problemas de producción.",Office y ocupaciones de apoyo administrativo
"Shipping, Receiving, and Inventory Clerks",2,Verify and maintain records on incoming and outgoing shipments involving inventory. Duties include verifying and recording incoming merchandise or material and arranging for the transportation of products. May prepare items for shipment.,Office and Administrative Support Occupations,43-5071.00,"Sabisteros de envío, recepción e inventario",Verifique y mantenga registros sobre envíos entrantes y salientes que involucren inventario. Las tareas incluyen verificar y registrar mercancías o material entrantes y organizar el transporte de productos. Puede preparar artículos para el envío.,Office y ocupaciones de apoyo administrativo
"Weighers, Measurers, Checkers, and Samplers, Recordkeeping",2,"Weigh, measure, and check materials, supplies, and equipment for the purpose of keeping relevant records. Duties are primarily clerical by nature. Includes workers who collect and keep record of samples of products or materials.",Office and Administrative Support Occupations,43-5111.00,"Pesadillas, medidores, damas y muestreadores, mantenimiento de registros","Pesar, medir y verificar materiales, suministros y equipos con el fin de mantener registros relevantes. Los deberes son principalmente clericales por naturaleza. Incluye trabajadores que recopilan y mantienen registros de muestras de productos o materiales.",Office y ocupaciones de apoyo administrativo
Executive Secretaries and Executive Administrative Assistants,3,"Provide high-level administrative support by conducting research, preparing statistical reports, and handling information requests, as well as performing routine administrative functions such as preparing correspondence, receiving visitors, arranging conference calls, and scheduling meetings. May also train and supervise lower-level clerical staff.",Office and Administrative Support Occupations,43-6011.00,Secretarios ejecutivos y asistentes administrativos ejecutivos,"Brindar apoyo administrativo de alto nivel realizando investigaciones, preparando informes estadísticos y manejar solicitudes de información, así como realizar funciones administrativas de rutina, como preparar correspondencia, recibir visitantes, organizar llamadas de conferencia y reuniones de programación. También puede entrenar y supervisar el personal administrativo de nivel inferior.",Office y ocupaciones de apoyo administrativo
Legal Secretaries and Administrative Assistants,3,"Perform secretarial duties using legal terminology, procedures, and documents. Prepare legal papers and correspondence, such as summonses, complaints, motions, and subpoenas. May also assist with legal research.",Office and Administrative Support Occupations,43-6012.00,Secretarios legales y asistentes administrativos,"Realizar tareas de secretaría utilizando terminología legal, procedimientos y documentos. Prepare documentos legales y correspondencia, como citaciones, quejas, mociones y citaciones. También puede ayudar con la investigación legal.",Office y ocupaciones de apoyo administrativo
Medical Secretaries and Administrative Assistants,2,"Perform secretarial duties using specific knowledge of medical terminology and hospital, clinic, or laboratory procedures. Duties may include scheduling appointments, billing patients, and compiling and recording medical charts, reports, and correspondence.",Office and Administrative Support Occupations,43-6013.00,Secretarios médicos y asistentes administrativos,"Realice tareas de secretaría utilizando conocimiento específico de terminología médica y procedimientos de hospital, clínicos o laboratorio. Las tareas pueden incluir citas de programación, facturación de pacientes y compilar y registrar gráficos médicos, informes y correspondencia.",Office y ocupaciones de apoyo administrativo
"Secretaries and Administrative Assistants, Except Legal, Medical, and Executive",2,"Perform routine administrative functions such as drafting correspondence, scheduling appointments, organizing and maintaining paper and electronic files, or providing information to callers.",Office and Administrative Support Occupations,43-6014.00,"Secretarios y asistentes administrativos, excepto legal, médico y ejecutivo","Realice funciones administrativas de rutina, como redactar correspondencia, programar citas, organizar y mantener archivos en papel y electrónicos, o proporcionar información a las personas que llaman.",Office y ocupaciones de apoyo administrativo
Data Entry Keyers,2,"Operate data entry device, such as keyboard or photo composing perforator. Duties may include verifying data and preparing materials for printing.",Office and Administrative Support Occupations,43-9021.00,Likeers de entrada de datos,"Opere el dispositivo de entrada de datos, como el perforador de composición de teclado o fotográfico. Las tareas pueden incluir verificar datos y preparar materiales para la impresión.",Office y ocupaciones de apoyo administrativo
Word Processors and Typists,2,"Use word processor, computer, or typewriter to type letters, reports, forms, or other material from rough draft, corrected copy, or voice recording. May perform other clerical duties as assigned.",Office and Administrative Support Occupations,43-9022.00,Procesadores de palabras y mecanógrafos,"Use el procesador de textos, la computadora o la máquina de escribir para escribir letras, informes, formularios u otro material de borrador, copia corregida o grabación de voz. Puede realizar otras tareas administrativas asignadas.",Office y ocupaciones de apoyo administrativo
Desktop Publishers,3,Format typescript and graphic elements using computer software to produce publication-ready material.,Office and Administrative Support Occupations,43-9031.00,Editores de escritorio,Formatear los tipos de mecanografiado y los elementos gráficos que utilizan software de computadora para producir material listo para la publicación.,Office y ocupaciones de apoyo administrativo
Insurance Claims and Policy Processing Clerks,2,"Process new insurance policies, modifications to existing policies, and claims forms. Obtain information from policyholders to verify the accuracy and completeness of information on claims forms, applications and related documents, and company records. Update existing policies and company records to reflect changes requested by policyholders and insurance company representatives.",Office and Administrative Support Occupations,43-9041.00,Reclamos de seguro y empleados de procesamiento de pólizas,"Procese nuevas pólizas de seguro, modificaciones a las políticas existentes y formularios de reclamos. Obtenga información de los asegurados para verificar la precisión e integridad de la información sobre formularios de reclamos, solicitudes y documentos relacionados, y registros de la Compañía. Actualice las pólizas y los registros de la compañía existentes para reflejar los cambios solicitados por los titulares de pólizas y los representantes de la compañía de seguros.",Office y ocupaciones de apoyo administrativo
"Mail Clerks and Mail Machine Operators, Except Postal Service",2,"Prepare incoming and outgoing mail for distribution. Time-stamp, open, read, sort, and route incoming mail; and address, seal, stamp, fold, stuff, and affix postage to outgoing mail or packages. Duties may also include keeping necessary records and completed forms.",Office and Administrative Support Occupations,43-9051.00,"Correo de empleados y operadores de máquina de correo, excepto el servicio postal","Prepare el correo entrante y saliente para su distribución. Correo de tiempo, abierto, lectura, clasificación y ruta de correo entrante; y dirección, sellar, sellar, pliegue, cosas y calmar el envío al correo o los paquetes salientes. Las tareas también pueden incluir mantener los registros necesarios y los formularios completos.",Office y ocupaciones de apoyo administrativo
"Office Clerks, General",2,"Perform duties too varied and diverse to be classified in any specific office clerical occupation, requiring knowledge of office systems and procedures. Clerical duties may be assigned in accordance with the office procedures of individual establishments and may include a combination of answering telephones, bookkeeping, typing or word processing, office machine operation, and filing.",Office and Administrative Support Occupations,43-9061.00,"Empleados de oficina, general","Realice las tareas demasiado variadas y diversas para clasificarse en cualquier ocupación clerical de oficina específica, que requiere conocimiento de los sistemas y procedimientos de oficina. Los deberes administrativos pueden asignarse de acuerdo con los procedimientos de la oficina de establecimientos individuales y pueden incluir una combinación de teléfonos contestadores, contabilidad, tipificación o procesamiento de textos, operación de la máquina de la oficina y presentación.",Office y ocupaciones de apoyo administrativo
"Office Machine Operators, Except Computer",2,"Operate one or more of a variety of office machines, such as photocopying, photographic, and duplicating machines, or other office machines.",Office and Administrative Support Occupations,43-9071.00,"Operadores de máquinas de oficina, excepto la computadora","Opere una o más de una variedad de máquinas de oficina, como fotocopias, máquinas fotográficas y duplicadas u otras máquinas de oficina.",Office y ocupaciones de apoyo administrativo
Proofreaders and Copy Markers,4,"Read transcript or proof type setup to detect and mark for correction any grammatical, typographical, or compositional errors. Excludes workers whose primary duty is editing copy. Includes proofreaders of braille.",Office and Administrative Support Occupations,43-9081.00,Correctores y marcadores de copia,"Lea la configuración de la transcripción o el tipo de prueba para detectar y marcar para la corrección cualquier error gramatical, tipográfico o compositivo. Excluye a los trabajadores cuyo deber principal es editar copia. Incluye correctores de Braille.",Office y ocupaciones de apoyo administrativo
Statistical Assistants,4,Compile and compute data according to statistical formulas for use in statistical studies. May perform actuarial computations and compile charts and graphs for use by actuaries. Includes actuarial clerks.,Office and Administrative Support Occupations,43-9111.00,Asistentes estadísticos,Compile y calcule los datos de acuerdo con fórmulas estadísticas para su uso en estudios estadísticos. Puede realizar cálculos actuariales y compilar gráficos y gráficos para su uso por actuarios. Incluye empleados actuariales.,Office y ocupaciones de apoyo administrativo
"First-Line Supervisors of Farming, Fishing, and Forestry Workers",3,"Directly supervise and coordinate the activities of agricultural, forestry, aquacultural, and related workers.","Farming, Fishing, and Forestry Occupations",45-1011.00,"Supervisores de primera línea de trabajadores de agricultura, pesca y forestales","Supervisar y coordinar directamente las actividades de los trabajadores agrícolas, forestales, acuiculturales y relacionados.","Agricultura, pesca y ocupaciones forestales"
Agricultural Inspectors,2,"Inspect agricultural commodities, processing equipment, and facilities, and fish and logging operations, to ensure compliance with regulations and laws governing health, quality, and safety.","Farming, Fishing, and Forestry Occupations",45-2011.00,Inspectores agrícolas,"Inspeccione los productos agrícolas, los equipos de procesamiento y las instalaciones, y las operaciones de pescado y de tala, para garantizar el cumplimiento de las regulaciones y leyes que rigen la salud, la calidad y la seguridad.","Agricultura, pesca y ocupaciones forestales"
Animal Breeders,2,"Select and breed animals according to their genealogy, characteristics, and offspring. May require knowledge of artificial insemination techniques and equipment use. May involve keeping records on heats, birth intervals, or pedigree.","Farming, Fishing, and Forestry Occupations",45-2021.00,Criadores de animales,"Seleccione y reproduzca animales de acuerdo con su genealogía, características y descendientes. Puede requerir conocimiento de las técnicas de inseminación artificial y el uso de equipos. Puede implicar mantener registros en calores, intervalos de nacimiento o pedigrí.","Agricultura, pesca y ocupaciones forestales"
"Graders and Sorters, Agricultural Products",1,"Grade, sort, or classify unprocessed food and other agricultural products by size, weight, color, or condition.","Farming, Fishing, and Forestry Occupations",45-2041.00,"Grados y clasificadores, productos agrícolas","Grado, clasificar o clasificar alimentos sin procesar y otros productos agrícolas por tamaño, peso, color o condición.","Agricultura, pesca y ocupaciones forestales"
Agricultural Equipment Operators,1,"Drive and control equipment to support agricultural activities such as tilling soil; planting, cultivating, and harvesting crops; feeding and herding livestock; or removing animal waste. May perform tasks such as crop baling or hay bucking. May operate stationary equipment to perform post-harvest tasks such as husking, shelling, threshing, and ginning.","Farming, Fishing, and Forestry Occupations",45-2091.00,Operadores de equipos agrícolas,"Conducir y controlar equipos para apoyar actividades agrícolas como la labranza del suelo; plantación, cultivo y cosecha de cultivos; alimentación y pastoreo de ganado; o eliminar los desechos animales. Puede realizar tareas como Baling o Bucking de heno. Puede operar equipos estacionarios para realizar tareas posteriores a la cosecha, como el fusking, el bombardeo, la trilla y el gining.","Agricultura, pesca y ocupaciones forestales"
"Farmworkers and Laborers, Crop, Nursery, and Greenhouse",1,"Manually plant, cultivate, and harvest vegetables, fruits, nuts, horticultural specialties, and field crops. Use hand tools, such as shovels, trowels, hoes, tampers, pruning hooks, shears, and knives. Duties may include tilling soil and applying fertilizers; transplanting, weeding, thinning, or pruning crops; applying pesticides; or cleaning, grading, sorting, packing, and loading harvested products. May construct trellises, repair fences and farm buildings, or participate in irrigation activities.","Farming, Fishing, and Forestry Occupations",45-2092.00,"Trabajadores de granja y trabajadores, cultivos, viveros y invernadero","Planta, cultivan y cosecha manualmente vegetales, frutas, nueces, especialidades hortícolas y cultivos de campo. Use herramientas manuales, como palas, hojas, azadas, manipuladores, ganchos de poda, tijeras y cuchillos. Las tareas pueden incluir el suelo de labrar y aplicar fertilizantes; trasplante, desmalezado, adelgazamiento o poda de cultivos; aplicando pesticidas; o limpieza, calificación, clasificación, embalaje y carga de productos cosechados. Puede construir enrejados, reparar cercas y edificios agrícolas, o participar en actividades de riego.","Agricultura, pesca y ocupaciones forestales"
"Farmworkers, Farm, Ranch, and Aquacultural Animals",2,"Attend to live farm, ranch, open range or aquacultural animals that may include cattle, sheep, swine, goats, horses and other equines, poultry, rabbits, finfish, shellfish, and bees. Attend to animals produced for animal products, such as meat, fur, skins, feathers, eggs, milk, and honey. Duties may include feeding, watering, herding, grazing, milking, castrating, branding, de-beaking, weighing, catching, and loading animals. May maintain records on animals; examine animals to detect diseases and injuries; assist in birth deliveries; and administer medications, vaccinations, or insecticides as appropriate. May clean and maintain animal housing areas. Includes workers who shear wool from sheep and collect eggs in hatcheries.","Farming, Fishing, and Forestry Occupations",45-2093.00,"Trabajadores agrícolas, granja, rancho y animales acuiculturales","Asistir a la granja en vivo, el rancho, el rango abierto o los animales acuiculturales que pueden incluir ganado, ovejas, cerdos, cabras, caballos y otros equinos, aves de corral, conejos, peces de altura, mariscos y abejas. Asistir a los animales producidos para productos animales, como carne, piel, pieles, plumas, huevos, leche y miel. Las tareas pueden incluir alimentación, riego, pastoreo, pastoreo, ordeño, castración, marca, desbogado, pesado, captura y carga de animales. Puede mantener registros en animales; examinar a los animales para detectar enfermedades y lesiones; Asistir en partos de nacimientos; y administrar medicamentos, vacunas o insecticidas según corresponda. Puede limpiar y mantener áreas de vivienda de animales. Incluye trabajadores que cortan la lana de las ovejas y recolectan huevos en criaderos.","Agricultura, pesca y ocupaciones forestales"
Fishing and Hunting Workers,1,"Hunt, trap, catch, or gather wild animals or aquatic animals and plants. May use nets, traps, or other equipment. May haul catch onto ship or other vessel.","Farming, Fishing, and Forestry Occupations",45-3031.00,Trabajadores de pesca y caza,"Caer, atrapar, atrapar o recoger animales salvajes o animales y plantas acuáticas. Puede usar redes, trampas u otros equipos. Puede llevar al barco u otro buque.","Agricultura, pesca y ocupaciones forestales"
Forest and Conservation Workers,3,"Under supervision, perform manual labor necessary to develop, maintain, or protect areas such as forests, forested areas, woodlands, wetlands, and rangelands through such activities as raising and transporting seedlings; combating insects, pests, and diseases harmful to plant life; and building structures to control water, erosion, and leaching of soil. Includes forester aides, seedling pullers, tree planters, and gatherers of nontimber forestry products such as pine straw.","Farming, Fishing, and Forestry Occupations",45-4011.00,Trabajadores de bosques y conservación,"Bajo supervisión, realice el trabajo manual necesario para desarrollar, mantener o proteger áreas como bosques, áreas boscosas, bosques, humedales y pastizales a través de actividades tales como criar y transportar plántulas; combatir insectos, plagas y enfermedades dañinas para la vida vegetal; y estructuras de construcción para controlar el agua, la erosión y la lixiviación del suelo. Incluye ayudantes de Forester, tiradores de plántulas, macetas de árboles y recolectores de productos forestales no inmobiliarios como Pine Straw.","Agricultura, pesca y ocupaciones forestales"
Fallers,1,Use axes or chainsaws to fell trees using knowledge of tree characteristics and cutting techniques to control direction of fall and minimize tree damage.,"Farming, Fishing, and Forestry Occupations",45-4021.00,Jugadores,Use ejes o motosierras en árboles de caída utilizando el conocimiento de las características del árbol y las técnicas de corte para controlar la dirección de la caída y minimizar el daño del árbol.,"Agricultura, pesca y ocupaciones forestales"
Logging Equipment Operators,1,"Drive logging tractor or wheeled vehicle equipped with one or more accessories, such as bulldozer blade, frontal shear, grapple, logging arch, cable winches, hoisting rack, or crane boom, to fell tree; to skid, load, unload, or stack logs; or to pull stumps or clear brush. Includes operating stand-alone logging machines, such as log chippers.","Farming, Fishing, and Forestry Occupations",45-4022.00,Operadores de equipos de registro,"Tractor de registro de conducción o vehículo con ruedas equipado con uno o más accesorios, como cuchilla de excavadora, cizallamiento frontal, agarre, arco de tala, cabrestantes de cabrestantes, estante para alza o boom de la grúa, para caer; para patinar, cargar, descargar o apilar registros; o para tirar de tocones o limpiar el cepillo. Incluye operaciones de máquinas de registro independientes, como chippers de registro.","Agricultura, pesca y ocupaciones forestales"
Log Graders and Scalers,2,"Grade logs or estimate the marketable content or value of logs or pulpwood in sorting yards, millpond, log deck, or similar locations. Inspect logs for defects or measure logs to determine volume.","Farming, Fishing, and Forestry Occupations",45-4023.00,Graders de registro y escaladores,"Registros de calificación o estimar el contenido o valor comercializable de los registros o la madera de pulpa en yardas de clasificación, Millpond, Deck o ubicaciones similares. Inspeccione los registros de defectos o mida los registros para determinar el volumen.","Agricultura, pesca y ocupaciones forestales"
First-Line Supervisors of Construction Trades and Extraction Workers,3,Directly supervise and coordinate activities of construction or extraction workers.,Construction and Extraction Occupations,47-1011.00,Supervisores de primera línea de los oficios de construcción y trabajadores de extracción,Supervisar y coordinar directamente las actividades de los trabajadores de construcción o extracción.,Ocupaciones de construcción y extracción
Solar Energy Installation Managers,3,Direct work crews installing residential or commercial solar photovoltaic or thermal systems.,Construction and Extraction Occupations,47-1011.03,Gerentes de instalación de energía solar,Tripulaciones de trabajo directo que instalan sistemas solares solares solares residenciales o comerciales.,Ocupaciones de construcción y extracción
