Title,Job Zone,Description,Domain,O*NET-SOC Code,spanish_title,spanish_description,spanish_domain
Climate Change Policy Analysts,5,"Research and analyze policy developments related to climate change. Make climate-related recommendations for actions such as legislation, awareness campaigns, or fundraising approaches.","Life, Physical, and Social Science Occupations",19-2041.01,Analistas de políticas de cambio climático,"Investigue y analice los desarrollos de políticas relacionados con el cambio climático. Haga recomendaciones relacionadas con el clima para acciones como legislación, campañas de concientización o enfoques de recaudación de fondos.","Ocupaciones de la vida, física y de las ciencias sociales"
Environmental Restoration Planners,5,"Collaborate with field and biology staff to oversee the implementation of restoration projects and to develop new products. Process and synthesize complex scientific data into practical strategies for restoration, monitoring or management.","Life, Physical, and Social Science Occupations",19-2041.02,Planificadores de restauración ambiental,"Colabora con el personal de campo y biología para supervisar la implementación de proyectos de restauración y desarrollar nuevos productos. Procese y sintetice datos científicos complejos en estrategias prácticas para la restauración, monitoreo o gestión.","Ocupaciones de la vida, física y de las ciencias sociales"
Industrial Ecologists,5,Apply principles and processes of natural ecosystems to develop models for efficient industrial systems. Use knowledge from the physical and social sciences to maximize effective use of natural resources in the production and use of goods and services. Examine societal issues and their relationship with both technical systems and the environment.,"Life, Physical, and Social Science Occupations",19-2041.03,Ecologistas industriales,Aplicar principios y procesos de ecosistemas naturales para desarrollar modelos para sistemas industriales eficientes. Use el conocimiento de las ciencias físicas y sociales para maximizar el uso efectivo de los recursos naturales en la producción y el uso de bienes y servicios. Examine los problemas sociales y su relación con los sistemas técnicos y el medio ambiente.,"Ocupaciones de la vida, física y de las ciencias sociales"
"Geoscientists, Except Hydrologists and Geographers",5,"Study the composition, structure, and other physical aspects of the Earth. May use geological, physics, and mathematics knowledge in exploration for oil, gas, minerals, or underground water; or in waste disposal, land reclamation, or other environmental problems. May study the Earth's internal composition, atmospheres, and oceans, and its magnetic, electrical, and gravitational forces. Includes mineralogists, paleontologists, stratigraphers, geodesists, and seismologists.","Life, Physical, and Social Science Occupations",19-2042.00,"Geocientíficos, excepto hidrólogos y geógrafos","Estudie la composición, la estructura y otros aspectos físicos de la tierra. Puede usar el conocimiento geológico, físico y matemático en exploración de petróleo, gas, minerales o agua subterránea; o en la eliminación de desechos, la recuperación de la tierra u otros problemas ambientales. Puede estudiar la composición interna de la Tierra, las atmósferas y los océanos, y sus fuerzas magnéticas, eléctricas y gravitacionales. Incluye mineralogistas, paleontólogos, estratigráficos, geodesistas y sismólogos.","Ocupaciones de la vida, física y de las ciencias sociales"
Hydrologists,5,"Research the distribution, circulation, and physical properties of underground and surface waters; and study the form and intensity of precipitation and its rate of infiltration into the soil, movement through the earth, and return to the ocean and atmosphere.","Life, Physical, and Social Science Occupations",19-2043.00,Hidólogos,"Investigar la distribución, circulación y propiedades físicas de las aguas subterráneas y superficiales; y estudie la forma y la intensidad de la precipitación y su tasa de infiltración en el suelo, el movimiento a través de la tierra y regrese al océano y la atmósfera.","Ocupaciones de la vida, física y de las ciencias sociales"
Remote Sensing Scientists and Technologists,5,"Apply remote sensing principles and methods to analyze data and solve problems in areas such as natural resource management, urban planning, or homeland security. May develop new sensor systems, analytical techniques, or new applications for existing systems.","Life, Physical, and Social Science Occupations",19-2099.01,Científicos y tecnólogos de teledetección,"Aplicar principios y métodos de teledetección para analizar datos y resolver problemas en áreas como la gestión de recursos naturales, la planificación urbana o la seguridad nacional. Puede desarrollar nuevos sistemas de sensores, técnicas analíticas o nuevas aplicaciones para sistemas existentes.","Ocupaciones de la vida, física y de las ciencias sociales"
Economists,5,"Conduct research, prepare reports, or formulate plans to address economic problems related to the production and distribution of goods and services or monetary and fiscal policy. May collect and process economic and statistical data using sampling techniques and econometric methods.","Life, Physical, and Social Science Occupations",19-3011.00,Economistas,"Realice investigaciones, prepare informes o formule planes para abordar los problemas económicos relacionados con la producción y distribución de bienes y servicios o política monetaria y fiscal. Puede recopilar y procesar datos económicos y estadísticos utilizando técnicas de muestreo y métodos econométricos.","Ocupaciones de la vida, física y de las ciencias sociales"
Environmental Economists,5,"Conduct economic analysis related to environmental protection and use of the natural environment, such as water, air, land, and renewable energy resources. Evaluate and quantify benefits, costs, incentives, and impacts of alternative options using economic principles and statistical techniques.","Life, Physical, and Social Science Occupations",19-3011.01,Economistas ambientales,"Realice un análisis económico relacionado con la protección del medio ambiente y el uso del medio ambiente natural, como el agua, el aire, la tierra y los recursos de energía renovable. Evaluar y cuantificar los beneficios, costos, incentivos e impactos de opciones alternativas utilizando principios económicos y técnicas estadísticas.","Ocupaciones de la vida, física y de las ciencias sociales"
Survey Researchers,5,"Plan, develop, or conduct surveys. May analyze and interpret the meaning of survey data, determine survey objectives, or suggest or test question wording. Includes social scientists who primarily design questionnaires or supervise survey teams.","Life, Physical, and Social Science Occupations",19-3022.00,Investigadores de encuestas,"Planificar, desarrollar o realizar encuestas. Puede analizar e interpretar el significado de los datos de la encuesta, determinar los objetivos de la encuesta o sugerir o probar la redacción de preguntas. Incluye científicos sociales que diseñan principalmente cuestionarios o supervisan a los equipos de encuestas.","Ocupaciones de la vida, física y de las ciencias sociales"
Industrial-Organizational Psychologists,5,"Apply principles of psychology to human resources, administration, management, sales, and marketing problems. Activities may include policy planning; employee testing and selection, training, and development; and organizational development and analysis. May work with management to organize the work setting to improve worker productivity.","Life, Physical, and Social Science Occupations",19-3032.00,Psicólogos de organización industrial,"Aplicar principios de psicología a los recursos humanos, la administración, la gestión, las ventas y los problemas de marketing. Las actividades pueden incluir la planificación de políticas; prueba y selección de empleados, capacitación y desarrollo; y desarrollo y análisis organizacionales. Puede trabajar con la gerencia para organizar el entorno de trabajo para mejorar la productividad de los trabajadores.","Ocupaciones de la vida, física y de las ciencias sociales"
Clinical and Counseling Psychologists,5,"Assess, diagnose, and treat mental and emotional disorders of individuals through observation, interview, and psychological tests. Help individuals with distress or maladjustment understand their problems through their knowledge of case history, interviews with patients, and theory. Provide individual or group counseling services to assist individuals in achieving more effective personal, social, educational, and vocational development and adjustment. May design behavior modification programs and consult with medical personnel regarding the best treatment for patients.","Life, Physical, and Social Science Occupations",19-3033.00,Psicólogos clínicos y de asesoramiento,"Evaluar, diagnosticar y tratar los trastornos mentales y emocionales de las personas a través de la observación, la entrevista y las pruebas psicológicas. Ayuda a las personas con angustia o desajuste a comprender sus problemas a través de su conocimiento del historial de casos, entrevistas con pacientes y teoría. Proporcione servicios de asesoramiento individual o grupal para ayudar a las personas a lograr un desarrollo y ajuste personal más efectivos, sociales, educativos y vocacionales. Puede diseñar programas de modificación de comportamiento y consultar con personal médico con respecto al mejor tratamiento para los pacientes.","Ocupaciones de la vida, física y de las ciencias sociales"
School Psychologists,5,"Diagnose and implement individual or schoolwide interventions or strategies to address educational, behavioral, or developmental issues that adversely impact educational functioning in a school. May address student learning and behavioral problems and counsel students or families. May design and implement performance plans, and evaluate performance. May consult with other school-based personnel.","Life, Physical, and Social Science Occupations",19-3034.00,Psicólogos escolares,"Diagnosticar e implementar intervenciones o estrategias individuales o escolares para abordar problemas educativos, conductuales o de desarrollo que afectan negativamente el funcionamiento educativo en una escuela. Puede abordar el aprendizaje de los estudiantes y los problemas de comportamiento y aconsejar a los estudiantes o familias. Puede diseñar e implementar planes de desempeño y evaluar el rendimiento. Puede consultar con otro personal escolar.","Ocupaciones de la vida, física y de las ciencias sociales"
Neuropsychologists,5,"Apply theories and principles of neuropsychology to evaluate and diagnose disorders of higher cerebral functioning, often in research and medical settings. Study the human brain and the effect of physiological states on human cognition and behavior. May formulate and administer programs of treatment.","Life, Physical, and Social Science Occupations",19-3039.02,Neuropsicólogos,"Aplicar teorías y principios de neuropsicología para evaluar y diagnosticar trastornos de un mayor funcionamiento cerebral, a menudo en investigaciones y entornos médicos. Estudie el cerebro humano y el efecto de los estados fisiológicos en la cognición y el comportamiento humano. Puede formular y administrar programas de tratamiento.","Ocupaciones de la vida, física y de las ciencias sociales"
Clinical Neuropsychologists,5,"Assess and diagnose patients with neurobehavioral problems related to acquired or developmental disorders of the nervous system, such as neurodegenerative disorders, traumatic brain injury, seizure disorders, and learning disabilities. Recommend treatment after diagnosis, such as therapy, medication, or surgery. Assist with evaluation before and after neurosurgical procedures, such as deep brain stimulation.","Life, Physical, and Social Science Occupations",19-3039.03,Neuropsicólogos clínicos,"Evaluar y diagnosticar a los pacientes con problemas neuroconductuales relacionados con los trastornos adquiridos o del desarrollo del sistema nervioso, como trastornos neurodegenerativos, lesiones cerebrales traumáticas, trastornos convulsivos y discapacidades de aprendizaje. Recomiende el tratamiento después del diagnóstico, como la terapia, la medicación o la cirugía. Asistir con la evaluación antes y después de los procedimientos neuroquirúrgicos, como la estimulación cerebral profunda.","Ocupaciones de la vida, física y de las ciencias sociales"
Sociologists,5,"Study human society and social behavior by examining the groups and social institutions that people form, as well as various social, religious, political, and business organizations. May study the behavior and interaction of groups, trace their origin and growth, and analyze the influence of group activities on individual members.","Life, Physical, and Social Science Occupations",19-3041.00,Sociólogos,"Estudie la sociedad humana y el comportamiento social examinando los grupos e instituciones sociales que forman las personas, así como varias organizaciones sociales, religiosas, políticas y empresariales. Puede estudiar el comportamiento y la interacción de los grupos, rastrear su origen y crecimiento, y analizar la influencia de las actividades grupales en los miembros individuales.","Ocupaciones de la vida, física y de las ciencias sociales"
Urban and Regional Planners,5,"Develop comprehensive plans and programs for use of land and physical facilities of jurisdictions, such as towns, cities, counties, and metropolitan areas.","Life, Physical, and Social Science Occupations",19-3051.00,Planificadores urbanos y regionales,"Desarrolle planes y programas integrales para el uso de tierras y instalaciones físicas de jurisdicciones, como pueblos, ciudades, condados y áreas metropolitanas.","Ocupaciones de la vida, física y de las ciencias sociales"
Anthropologists and Archeologists,5,"Study the origin, development, and behavior of human beings. May study the way of life, language, or physical characteristics of people in various parts of the world. May engage in systematic recovery and examination of material evidence, such as tools or pottery remaining from past human cultures, in order to determine the history, customs, and living habits of earlier civilizations.","Life, Physical, and Social Science Occupations",19-3091.00,Antropólogos y arqueólogos,"Estudie el origen, el desarrollo y el comportamiento de los seres humanos. Puede estudiar la forma de vida, el lenguaje o las características físicas de las personas en varias partes del mundo. Puede participar en la recuperación sistemática y el examen de evidencia material, como herramientas o cerámica que quedan de culturas humanas pasadas, para determinar la historia, las costumbres y los hábitos vivos de las civilizaciones anteriores.","Ocupaciones de la vida, física y de las ciencias sociales"
Geographers,5,"Study the nature and use of areas of the Earth's surface, relating and interpreting interactions of physical and cultural phenomena. Conduct research on physical aspects of a region, including land forms, climates, soils, plants, and animals, and conduct research on the spatial implications of human activities within a given area, including social characteristics, economic activities, and political organization, as well as researching interdependence between regions at scales ranging from local to global.","Life, Physical, and Social Science Occupations",19-3092.00,Geógrafos,"Estudie la naturaleza y el uso de las áreas de la superficie de la Tierra, relacionando e interpretando las interacciones de los fenómenos físicos y culturales. Realice una investigación sobre aspectos físicos de una región, incluidas las formas de tierras, climas, suelos, plantas y animales, y realice investigaciones sobre las implicaciones espaciales de las actividades humanas dentro de un área determinada, incluidas las características sociales, las actividades económicas y la organización política, así como como investigar la interdependencia entre regiones a escalas que van desde locales hasta globales.","Ocupaciones de la vida, física y de las ciencias sociales"
Historians,5,"Research, analyze, record, and interpret the past as recorded in sources, such as government and institutional records, newspapers and other periodicals, photographs, interviews, films, electronic media, and unpublished manuscripts, such as personal diaries and letters.","Life, Physical, and Social Science Occupations",19-3093.00,Historiadores,"Investigar, analizar, registrar e interpretar el pasado como se registra en fuentes, como registros gubernamentales e institucionales, periódicos y otras publicaciones periódicas, fotografías, entrevistas, películas, medios electrónicos y manuscritos no publicados, como diarios y cartas personales.","Ocupaciones de la vida, física y de las ciencias sociales"
Political Scientists,5,"Study the origin, development, and operation of political systems. May study topics, such as public opinion, political decisionmaking, and ideology. May analyze the structure and operation of governments, as well as various political entities. May conduct public opinion surveys, analyze election results, or analyze public documents.","Life, Physical, and Social Science Occupations",19-3094.00,Politólogos,"Estudie el origen, el desarrollo y la operación de los sistemas políticos. Puede estudiar temas, como la opinión pública, la toma de decisiones políticas e ideología. Puede analizar la estructura y operación de los gobiernos, así como varias entidades políticas. Puede realizar encuestas de opinión pública, analizar los resultados de las elecciones o analizar documentos públicos.","Ocupaciones de la vida, física y de las ciencias sociales"
Transportation Planners,4,"Prepare studies for proposed transportation projects. Gather, compile, and analyze data. Study the use and operation of transportation systems. Develop transportation models or simulations.","Life, Physical, and Social Science Occupations",19-3099.01,Planificadores de transporte,"Prepare estudios para proyectos de transporte propuestos. Recopilar, compilar y analizar datos. Estudie el uso y operación de los sistemas de transporte. Desarrollar modelos de transporte o simulaciones.","Ocupaciones de la vida, física y de las ciencias sociales"
Agricultural Technicians,3,"Work with agricultural scientists in plant, fiber, and animal research, or assist with animal breeding and nutrition. Set up or maintain laboratory equipment and collect samples from crops or animals. Prepare specimens or record data to assist scientists in biology or related life science experiments. Conduct tests and experiments to improve yield and quality of crops or to increase the resistance of plants and animals to disease or insects.","Life, Physical, and Social Science Occupations",19-4012.00,Técnicos agrícolas,"Trabaje con científicos agrícolas en la investigación de plantas, fibra y animales, o ayude con la cría y nutrición de los animales. Establezca o mantenga equipos de laboratorio y recolecte muestras de cultivos o animales. Prepare especímenes o datos registrados para ayudar a los científicos en biología o experimentos relacionados con la ciencia de la vida. Realice pruebas y experimentos para mejorar el rendimiento y la calidad de los cultivos o para aumentar la resistencia de plantas y animales a enfermedades o insectos.","Ocupaciones de la vida, física y de las ciencias sociales"
Precision Agriculture Technicians,4,"Apply geospatial technologies, including geographic information systems (GIS) and Global Positioning System (GPS), to agricultural production or management activities, such as pest scouting, site-specific pesticide application, yield mapping, or variable-rate irrigation. May use computers to develop or analyze maps or remote sensing images to compare physical topography with data on soils, fertilizer, pests, or weather.","Life, Physical, and Social Science Occupations",19-4012.01,Técnicos agrícolas de precisión,"Aplique tecnologías geoespaciales, incluidos los sistemas de información geográfica (SIG) y el sistema de posicionamiento global (GPS), a las actividades de producción o gestión agrícola, como la exploración de plagas, la aplicación de pesticidas específicos del sitio, el mapeo de rendimiento o el riego de tasa variable. Puede usar computadoras para desarrollar o analizar mapas o imágenes de teledetección para comparar la topografía física con datos sobre suelos, fertilizantes, plagas o clima.","Ocupaciones de la vida, física y de las ciencias sociales"
Food Science Technicians,3,"Work with food scientists or technologists to perform standardized qualitative and quantitative tests to determine physical or chemical properties of food or beverage products. Includes technicians who assist in research and development of production technology, quality control, packaging, processing, and use of foods.","Life, Physical, and Social Science Occupations",19-4013.00,Técnicos de ciencias de los alimentos,"Trabaje con científicos o tecnólogos de alimentos para realizar pruebas cualitativas y cuantitativas estandarizadas para determinar las propiedades físicas o químicas de los productos de alimentos o bebidas. Incluye técnicos que ayudan en la investigación y el desarrollo de la tecnología de producción, el control de calidad, el embalaje, el procesamiento y el uso de alimentos.","Ocupaciones de la vida, física y de las ciencias sociales"
Biological Technicians,4,"Assist biological and medical scientists. Set up, operate, and maintain laboratory instruments and equipment, monitor experiments, collect data and samples, make observations, and calculate and record results. May analyze organic substances, such as blood, food, and drugs.","Life, Physical, and Social Science Occupations",19-4021.00,Técnicos biológicos,"Ayudar a científicos biológicos y médicos. Configure, opere y mantenga instrumentos y equipos de laboratorio, monitoree experimentos, recopile datos y muestras, realice observaciones y calcule y registre los resultados. Puede analizar sustancias orgánicas, como sangre, alimentos y drogas.","Ocupaciones de la vida, física y de las ciencias sociales"
Chemical Technicians,3,"Conduct chemical and physical laboratory tests to assist scientists in making qualitative and quantitative analyses of solids, liquids, and gaseous materials for research and development of new products or processes, quality control, maintenance of environmental standards, and other work involving experimental, theoretical, or practical application of chemistry and related sciences.","Life, Physical, and Social Science Occupations",19-4031.00,Técnicos químicos,"Realice pruebas de laboratorio químico y físico para ayudar a los científicos a realizar análisis cualitativos y cuantitativos de sólidos, líquidos y materiales gaseosos para la investigación y desarrollo de nuevos productos o procesos, control de calidad, mantenimiento de estándares ambientales y otros trabajos que involucran experimentales, teóricos o teóricos o teóricos Aplicación práctica de química y ciencias relacionadas.","Ocupaciones de la vida, física y de las ciencias sociales"
"Environmental Science and Protection Technicians, Including Health",4,"Perform laboratory and field tests to monitor the environment and investigate sources of pollution, including those that affect health, under the direction of an environmental scientist, engineer, or other specialist. May collect samples of gases, soil, water, and other materials for testing.","Life, Physical, and Social Science Occupations",19-4042.00,"Técnicos de ciencia ambiental y protección, incluida la salud","Realice pruebas de laboratorio y de campo para monitorear el medio ambiente e investigar fuentes de contaminación, incluidas las que afectan la salud, bajo la dirección de un científico ambiental, ingeniero u otro especialista. Puede recolectar muestras de gases, suelo, agua y otros materiales para las pruebas.","Ocupaciones de la vida, física y de las ciencias sociales"
"Geological Technicians, Except Hydrologic Technicians",4,"Assist scientists or engineers in the use of electronic, sonic, or nuclear measuring instruments in laboratory, exploration, and production activities to obtain data indicating resources such as metallic ore, minerals, gas, coal, or petroleum. Analyze mud and drill cuttings. Chart pressure, temperature, and other characteristics of wells or bore holes.","Life, Physical, and Social Science Occupations",19-4043.00,"Técnicos geológicos, excepto técnicos hidrológicos","Asistir a científicos o ingenieros en el uso de instrumentos de medición electrónicos, sonoros o nucleares en actividades de laboratorio, exploración y producción para obtener datos que indicen recursos como mineral metálico, minerales, gas, carbón o petróleo. Analice los esquejes de barro y perforación. Presión del gráfico, temperatura y otras características de pozos o agujeros de orificio.","Ocupaciones de la vida, física y de las ciencias sociales"
