Title,Job Zone,Description,Domain,O*NET-SOC Code,french_title,french_description,french_domain
Construction Laborers,2,"Perform tasks involving physical labor at construction sites. May operate hand and power tools of all types: air hammers, earth tampers, cement mixers, small mechanical hoists, surveying and measuring equipment, and a variety of other equipment and instruments. May clean and prepare sites, dig trenches, set braces to support the sides of excavations, erect scaffolding, and clean up rubble, debris, and other waste materials. May assist other craft workers.",Construction and Extraction Occupations,47-2061.00,Ouvriers de la construction,"Effectuer des tâches impliquant un travail physique sur les chantiers de construction. Peut exploiter des outils manuels et électriques de tous types: marteaux d'air, tampers de terre, mélangeurs de ciment, petits palans mécaniques, équipement d'arpentage et de mesure, et une variété d'autres équipements et instruments. Peut nettoyer et préparer les sites, creuser des tranchées, régler les accolades pour soutenir les côtés des fouilles, ériger des échafaudages et nettoyer les décombres, les débris et d'autres déchets. Peut aider d'autres travailleurs artisanaux.",Occupations de construction et d'extraction
"Paving, Surfacing, and Tamping Equipment Operators",2,"Operate equipment used for applying concrete, asphalt, or other materials to road beds, parking lots, or airport runways and taxiways or for tamping gravel, dirt, or other materials. Includes concrete and asphalt paving machine operators, form tampers, tamping machine operators, and stone spreader operators.",Construction and Extraction Occupations,47-2071.00,"Opérateurs d'équipements de pavage, de surfaçage et de tamponner","Fonctionnez l'équipement utilisé pour l'application de béton, d'asphalte ou d'autres matériaux sur les plates-formes de route, les parkings ou les pistes et les voies de taxi d'aéroport ou pour tamponner le gravier, la saleté ou d'autres matériaux. Comprend des opérateurs de machines à pavage en béton et en asphalte, former des sabots, des opérateurs de machines à tamponner et des opérateurs d'épandeurs en pierre.",Occupations de construction et d'extraction
Pile Driver Operators,2,"Operate pile drivers mounted on skids, barges, crawler treads, or locomotive cranes to drive pilings for retaining walls, bulkheads, and foundations of structures such as buildings, bridges, and piers.",Construction and Extraction Occupations,47-2072.00,Opérateurs de pilotes de tas,"Faire fonctionner des pilotes de piles montés sur des patins, des barges, des marches de chenilles ou des grues de locomotive pour conduire des pilotis pour les murs de soutènement, les cloisons et les fondements de structures telles que les bâtiments, les ponts et les piliers.",Occupations de construction et d'extraction
Operating Engineers and Other Construction Equipment Operators,2,"Operate one or several types of power construction equipment, such as motor graders, bulldozers, scrapers, compressors, pumps, derricks, shovels, tractors, or front-end loaders to excavate, move, and grade earth, erect structures, or pour concrete or other hard surface pavement. May repair and maintain equipment in addition to other duties.",Construction and Extraction Occupations,47-2073.00,Ingénieurs d'exploitation et autres opérateurs d'équipements de construction,"Exploitez un ou plusieurs types d'équipements de construction d'énergie, tels que les élèves automobiles, les bulldozers, les grattoirs, les compresseurs, les pompes, les derricks, les pelles, les tracteurs ou les chargeurs frontaux pour fouiller, se déplacer et grade de la terre, ériger des structures ou verser du béton ou Autre chaussée de surface dure. Peut réparer et maintenir l'équipement en plus d'autres tâches.",Occupations de construction et d'extraction
Drywall and Ceiling Tile Installers,2,"Apply plasterboard or other wallboard to ceilings or interior walls of buildings. Apply or mount acoustical tiles or blocks, strips, or sheets of shock-absorbing materials to ceilings and walls of buildings to reduce or reflect sound. Materials may be of decorative quality. Includes lathers who fasten wooden, metal, or rockboard lath to walls, ceilings, or partitions of buildings to provide support base for plaster, fireproofing, or acoustical material.",Construction and Extraction Occupations,47-2081.00,Installateurs de carreaux de cloisons sèches et de plafond,"Appliquez des panneaux de plâtre ou d'autres panneaux muraux sur des plafonds ou des murs intérieurs des bâtiments. Appliquer ou monter des carreaux ou des blocs acoustiques, des bandes ou des feuilles de matériaux absorbant les chocs sur les plafonds et les murs des bâtiments pour réduire ou refléter le son. Les matériaux peuvent être de qualité décorative. Comprend des caillots qui fixent des lattes en bois, en métal ou en roche aux murs, plafonds ou partitions de bâtiments pour fournir une base de support pour le plâtre, le feu ignifuge ou le matériau acoustique.",Occupations de construction et d'extraction
Tapers,2,Seal joints between plasterboard or other wallboard to prepare wall surface for painting or papering.,Construction and Extraction Occupations,47-2082.00,Se cacher,Joix des joints entre le plâtre ou tout autre panneau mural pour préparer la surface du mur pour la peinture ou le papeting.,Occupations de construction et d'extraction
Electricians,3,"Install, maintain, and repair electrical wiring, equipment, and fixtures. Ensure that work is in accordance with relevant codes. May install or service street lights, intercom systems, or electrical control systems.",Construction and Extraction Occupations,47-2111.00,Électriciens,"Installer, maintenir et réparer le câblage électrique, l'équipement et les accessoires. Assurez-vous que les travaux sont conformes aux codes pertinents. Peut installer ou service des réverbères, des systèmes d'interphone ou des systèmes de contrôle électrique.",Occupations de construction et d'extraction
Glaziers,2,"Install glass in windows, skylights, store fronts, and display cases, or on surfaces, such as building fronts, interior walls, ceilings, and tabletops.",Construction and Extraction Occupations,47-2121.00,Vitrines,"Installez le verre dans les fenêtres, les puits de lumière, les fronts de stockage et les vitrines, ou sur des surfaces, tels que les fronts de construction, les murs intérieurs, les plafonds et les tableaux de table.",Occupations de construction et d'extraction
"Insulation Workers, Floor, Ceiling, and Wall",2,"Line and cover structures with insulating materials. May work with batt, roll, or blown insulation materials.",Construction and Extraction Occupations,47-2131.00,"Travailleurs d'isolation, plancher, plafond et mur","Structures de ligne et de couverture avec des matériaux isolants. Peut travailler avec des matériaux d'isolation Batt, Roll ou Blown.",Occupations de construction et d'extraction
"Insulation Workers, Mechanical",2,"Apply insulating materials to pipes or ductwork, or other mechanical systems in order to help control and maintain temperature.",Construction and Extraction Occupations,47-2132.00,"Travailleurs de l'isolation, mécanique","Appliquer des matériaux isolants aux tuyaux ou aux conduits, ou à d'autres systèmes mécaniques afin d'aider à contrôler et à maintenir la température.",Occupations de construction et d'extraction
"Painters, Construction and Maintenance",2,"Paint walls, equipment, buildings, bridges, and other structural surfaces, using brushes, rollers, and spray guns. May remove old paint to prepare surface prior to painting. May mix colors or oils to obtain desired color or consistency.",Construction and Extraction Occupations,47-2141.00,"Peintres, construction et entretien","Peindre les murs, l'équipement, les bâtiments, les ponts et autres surfaces structurelles, à l'aide de pinceaux, de rouleaux et de pistolets. Peut éliminer la vieille peinture pour préparer la surface avant la peinture. Peut mélanger les couleurs ou les huiles pour obtenir la couleur ou la consistance souhaitée.",Occupations de construction et d'extraction
Paperhangers,2,"Cover interior walls or ceilings of rooms with decorative wallpaper or fabric, or attach advertising posters on surfaces such as walls and billboards. May remove old materials or prepare surfaces to be papered.",Construction and Extraction Occupations,47-2142.00,Papier de papier,"Couvrir les murs intérieurs ou les plafonds de pièces avec du papier peint ou du tissu décoratif, ou attacher des affiches publicitaires sur des surfaces telles que les murs et les panneaux d'affichage. Peut éliminer les anciens matériaux ou préparer des surfaces à être souscrites.",Occupations de construction et d'extraction
Pipelayers,2,"Lay pipe for storm or sanitation sewers, drains, and water mains. Perform any combination of the following tasks: grade trenches or culverts, position pipe, or seal joints.",Construction and Extraction Occupations,47-2151.00,Pipettes,"Posez des tuyaux pour les égouts de tempête ou d'assainissement, les drains et les conduites d'eau. Effectuez toute combinaison des tâches suivantes: tranchées de qualité ou ponceaux, tuyaux de position ou joints de joint.",Occupations de construction et d'extraction
"Plumbers, Pipefitters, and Steamfitters",3,"Assemble, install, alter, and repair pipelines or pipe systems that carry water, steam, air, or other liquids or gases. May install heating and cooling equipment and mechanical control systems. Includes sprinkler fitters.",Construction and Extraction Occupations,47-2152.00,"Plombiers, tuyaux et vapeur","Assemblez, installez, modifiez et réparez des pipelines ou des systèmes de tuyaux qui transportent de l'eau, de la vapeur, de l'air ou d'autres liquides ou des gaz. Peut installer des équipements de chauffage et de refroidissement et des systèmes de contrôle mécanique. Comprend des monteurs d'arrosage.",Occupations de construction et d'extraction
Solar Thermal Installers and Technicians,3,"Install or repair solar energy systems designed to collect, store, and circulate solar-heated water for residential, commercial or industrial use.",Construction and Extraction Occupations,47-2152.04,Installateurs et techniciens solaires,"Installer ou réparer les systèmes d'énergie solaire conçus pour collecter, stocker et faire circuler l'eau chauffée à la chauffage à usage résidentiel, commercial ou industriel.",Occupations de construction et d'extraction
Plasterers and Stucco Masons,1,"Apply interior or exterior plaster, cement, stucco, or similar materials. May also set ornamental plaster.",Construction and Extraction Occupations,47-2161.00,Plâtriers et maçons de stuc,"Appliquer un plâtre intérieur ou extérieur, du ciment, du stuc ou des matériaux similaires. Peut également définir le plâtre ornemental.",Occupations de construction et d'extraction
Reinforcing Iron and Rebar Workers,2,"Position and secure steel bars or mesh in concrete forms in order to reinforce concrete. Use a variety of fasteners, rod-bending machines, blowtorches, and hand tools. Includes rod busters.",Construction and Extraction Occupations,47-2171.00,Renforcer les travailleurs du fer et des barres d'armature,"Position et barres en acier sécurisées ou maillage sous forme de béton afin de renforcer le béton. Utilisez une variété d'attaches, de machines à bilan de cannes, de chalumeurs et d'outils à main. Comprend Rod Busters.",Occupations de construction et d'extraction
Roofers,2,"Cover roofs of structures with shingles, slate, asphalt, aluminum, wood, or related materials. May spray roofs, sidings, and walls with material to bind, seal, insulate, or soundproof sections of structures.",Construction and Extraction Occupations,47-2181.00,Cacheurs,"Couvrir les toits des structures avec des bardeaux, de l'ardoise, de l'asphalte, de l'aluminium, du bois ou des matériaux connexes. Peut pulvériser des toits, des écarts et des murs avec du matériau pour lier, sceller, isoler ou insonancer des sections de structures.",Occupations de construction et d'extraction
Sheet Metal Workers,2,"Fabricate, assemble, install, and repair sheet metal products and equipment, such as ducts, control boxes, drainpipes, and furnace casings. Work may involve any of the following: setting up and operating fabricating machines to cut, bend, and straighten sheet metal; shaping metal over anvils, blocks, or forms using hammer; operating soldering and welding equipment to join sheet metal parts; or inspecting, assembling, and smoothing seams and joints of burred surfaces. Includes sheet metal duct installers who install prefabricated sheet metal ducts used for heating, air conditioning, or other purposes.",Construction and Extraction Occupations,47-2211.00,Tôlerie,"Fabriquer, assembler, installer et réparer les produits et l'équipement en tôle, tels que les conduits, les boîtes de commande, les épipes de drainage et les boîtiers de four. Les travaux peuvent impliquer l'une des éléments suivants: Configuration et fonctionnement des machines de fabrication pour couper, plier et redresser la tôle; façonner le métal sur les enclumes, les blocs ou les formes à l'aide de marteau; Équipement de soudage et de soudage de fonctionnement pour rejoindre des pièces en tôle; ou inspecter, assembler et lisser les coutures et les joints des surfaces du marbre. Comprend les installateurs de conduits en tôle qui installent des conduits de tôle préfabriqués utilisés pour le chauffage, la climatisation ou à d'autres fins.",Occupations de construction et d'extraction
Structural Iron and Steel Workers,2,"Raise, place, and unite iron or steel girders, columns, and other structural members to form completed structures or structural frameworks. May erect metal storage tanks and assemble prefabricated metal buildings.",Construction and Extraction Occupations,47-2221.00,Travailleurs de fer et d'acier structurels,"Soulever, placer et unir des poutres en fer ou en acier, des colonnes et d'autres membres structurels pour former des structures terminées ou des cadres structurels. Peut ériger des réservoirs de stockage métallique et assembler les bâtiments métalliques préfabriqués.",Occupations de construction et d'extraction
Solar Photovoltaic Installers,2,"Assemble, install, or maintain solar photovoltaic (PV) systems on roofs or other structures in compliance with site assessment and schematics. May include measuring, cutting, assembling, and bolting structural framing and solar modules. May perform minor electrical work such as current checks.",Construction and Extraction Occupations,47-2231.00,Installateurs solaires photovoltaïques,"Assemblez, installez ou maintenez les systèmes solaires photovoltaïques (PV) sur les toits ou autres structures conformément à l'évaluation du site et aux schémas. Peut inclure la mesure, la coupe, l'assemblage et les modules de charpente structurelle et solaire de boulonnage. Peut effectuer des travaux électriques mineurs tels que les contrôles de courant.",Occupations de construction et d'extraction
"Helpers--Brickmasons, Blockmasons, Stonemasons, and Tile and Marble Setters",2,"Help brickmasons, blockmasons, stonemasons, or tile and marble setters by performing duties requiring less skill. Duties include using, supplying, or holding materials or tools, and cleaning work area and equipment.",Construction and Extraction Occupations,47-3011.00,"Aiders - Brickmasons, Blockmasons, Stonemasons et Tile and Marble Settrs","Aidez les massons de briques, les massons de blocs, les stonemasons ou les carreaux et les sets en marbre en effectuant des tâches nécessitant moins de compétences. Les tâches comprennent l'utilisation, la fourniture ou la détention de matériaux ou d'outils et de nettoyage de la zone de travail et de l'équipement.",Occupations de construction et d'extraction
Helpers--Carpenters,2,"Help carpenters by performing duties requiring less skill. Duties include using, supplying, or holding materials or tools, and cleaning work area and equipment.",Construction and Extraction Occupations,47-3012.00,Aiders - Garpentieurs,"Aidez les charpentiers en effectuant des tâches nécessitant moins de compétences. Les tâches comprennent l'utilisation, la fourniture ou la détention de matériaux ou d'outils et de nettoyage de la zone de travail et de l'équipement.",Occupations de construction et d'extraction
Helpers--Electricians,2,"Help electricians by performing duties requiring less skill. Duties include using, supplying, or holding materials or tools, and cleaning work area and equipment.",Construction and Extraction Occupations,47-3013.00,Aiders - Electriciens,"Aidez les électriciens en exerçant des tâches nécessitant moins de compétences. Les tâches comprennent l'utilisation, la fourniture ou la détention de matériaux ou d'outils et de nettoyage de la zone de travail et de l'équipement.",Occupations de construction et d'extraction
"Helpers--Painters, Paperhangers, Plasterers, and Stucco Masons",1,"Help painters, paperhangers, plasterers, or stucco masons by performing duties requiring less skill. Duties include using, supplying, or holding materials or tools, and cleaning work area and equipment.",Construction and Extraction Occupations,47-3014.00,"Aiders - Painters, Paperhangers, Plasterers et stuc Masons","Aidez les peintres, les papier de papier, les plâtriers ou les maçons en stuc en effectuant des tâches nécessitant moins de compétences. Les tâches comprennent l'utilisation, la fourniture ou la détention de matériaux ou d'outils et de nettoyage de la zone de travail et de l'équipement.",Occupations de construction et d'extraction
"Helpers--Pipelayers, Plumbers, Pipefitters, and Steamfitters",2,"Help plumbers, pipefitters, steamfitters, or pipelayers by performing duties requiring less skill. Duties include using, supplying, or holding materials or tools, and cleaning work area and equipment.",Construction and Extraction Occupations,47-3015.00,"Aiders - Pipelayers, plombiers, tuyaux et Steamfitters","Aidez les plombiers, les pipetters, les tampons ou les piperies en exerçant des tâches nécessitant moins de compétences. Les tâches comprennent l'utilisation, la fourniture ou la détention de matériaux ou d'outils et de nettoyage de la zone de travail et de l'équipement.",Occupations de construction et d'extraction
Helpers--Roofers,2,"Help roofers by performing duties requiring less skill. Duties include using, supplying, or holding materials or tools, and cleaning work area and equipment.",Construction and Extraction Occupations,47-3016.00,Aiders - toit,"Aidez les couvreurs en effectuant des tâches nécessitant moins de compétences. Les tâches comprennent l'utilisation, la fourniture ou la détention de matériaux ou d'outils et de nettoyage de la zone de travail et de l'équipement.",Occupations de construction et d'extraction
Construction and Building Inspectors,3,"Inspect structures using engineering skills to determine structural soundness and compliance with specifications, building codes, and other regulations. Inspections may be general in nature or may be limited to a specific area, such as electrical systems or plumbing.",Construction and Extraction Occupations,47-4011.00,Inspecteurs de la construction et du bâtiment,"Inspectez les structures utilisant des compétences en ingénierie pour déterminer la solidité structurelle et la conformité avec les spécifications, les codes du bâtiment et d'autres réglementations. Les inspections peuvent être de nature générale ou peuvent être limitées à une zone spécifique, telles que les systèmes électriques ou la plomberie.",Occupations de construction et d'extraction
Energy Auditors,3,"Conduct energy audits of buildings, building systems, or process systems. May also conduct investment grade audits of buildings or systems.",Construction and Extraction Occupations,47-4011.01,Auditeurs énergétiques,"Conduire des audits énergétiques des bâtiments, des systèmes de construction ou des systèmes de processus. Peut également effectuer des audits de classement des bâtiments ou des systèmes.",Occupations de construction et d'extraction
Elevator and Escalator Installers and Repairers,3,"Assemble, install, repair, or maintain electric or hydraulic freight or passenger elevators, escalators, or dumbwaiters.",Construction and Extraction Occupations,47-4021.00,Installateurs et réparateurs d'ascenseur et d'escalator,"Assembler, installer, réparer ou maintenir le fret électrique ou hydraulique ou les ascenseurs, les escaliers mécaniques ou les hicwaiteurs.",Occupations de construction et d'extraction
Fence Erectors,2,"Erect and repair fences and fence gates, using hand and power tools.",Construction and Extraction Occupations,47-4031.00,Éreintes de clôture,"Ériger et réparer les clôtures et les portes de clôture, à l'aide d'outils manuels et électriques.",Occupations de construction et d'extraction
Hazardous Materials Removal Workers,3,"Identify, remove, pack, transport, or dispose of hazardous materials, including asbestos, lead-based paint, waste oil, fuel, transmission fluid, radioactive materials, or contaminated soil. Specialized training and certification in hazardous materials handling or a confined entry permit are generally required. May operate earth-moving equipment or trucks.",Construction and Extraction Occupations,47-4041.00,Travailleurs d'élimination des matières dangereuses,"Identifier, retirer, emballer, transporter ou éliminer les matières dangereuses, y compris l'amiante, la peinture à base de plomb, l'huile de déchets, le carburant, le liquide de transmission, les matières radioactives ou le sol contaminé. Une formation et une certification spécialisées dans la manutention des matières dangereuses ou un permis d'entrée confiné sont généralement nécessaires. Peut utiliser des équipements ou des camions en mouvement de la terre.",Occupations de construction et d'extraction
Highway Maintenance Workers,2,"Maintain highways, municipal and rural roads, airport runways, and rights-of-way. Duties include patching broken or eroded pavement and repairing guard rails, highway markers, and snow fences. May also mow or clear brush from along road, or plow snow from roadway.",Construction and Extraction Occupations,47-4051.00,Travailleurs de l'entretien des routes,"Maintenir les autoroutes, les routes municipales et rurales, les pistes d'aéroport et les droits de route. Les tâches comprennent le patchage de la chaussée cassée ou érodée et la réparation des rails de garde, des marqueurs routiers et des clôtures de neige. Peut également tondre ou dégager un brossage le long de la route, ou labourer la neige depuis la route.",Occupations de construction et d'extraction
Rail-Track Laying and Maintenance Equipment Operators,2,"Lay, repair, and maintain track for standard or narrow-gauge railroad equipment used in regular railroad service or in plant yards, quarries, sand and gravel pits, and mines. Includes ballast cleaning machine operators and railroad bed tamping machine operators.",Construction and Extraction Occupations,47-4061.00,Opérateurs d'équipements de pose et d'entretien de la voie ferrée,"Posez, réparez et maintenez la voie des équipements ferroviaires standard ou à calibre étroite utilisés dans le service ferroviaire ordinaire ou dans les cours d'usine, les carrières, les puits de sable et de gravier et les mines. Comprend les opérateurs de machines de nettoyage de ballast et les opérateurs de machines à tampons de chemins de fer.",Occupations de construction et d'extraction
Septic Tank Servicers and Sewer Pipe Cleaners,1,"Clean and repair septic tanks, sewer lines, or drains. May patch walls and partitions of tank, replace damaged drain tile, or repair breaks in underground piping.",Construction and Extraction Occupations,47-4071.00,Services à la fosse septique et nettoyeurs de tuyaux d'égout,"Nettoyez et réparez les fosses septiques, les conduites d'égout ou les drains. Peut réparer les murs et les partitions du réservoir, remplacer les carreaux de vidange endommagés ou réparer les pauses dans la tuyauterie souterraine.",Occupations de construction et d'extraction
Segmental Pavers,2,"Lay out, cut, and place segmental paving units. Includes installers of bedding and restraining materials for the paving units.",Construction and Extraction Occupations,47-4091.00,Pavés segmentaires,"Disposez, coupez et placez les unités de pavage segmentaires. Comprend les installateurs de la litière et les matériaux d'interdiction pour les unités de pavage.",Occupations de construction et d'extraction
Weatherization Installers and Technicians,2,"Perform a variety of activities to weatherize homes and make them more energy efficient. Duties include repairing windows, insulating ducts, and performing heating, ventilating, and air-conditioning (HVAC) work. May perform energy audits and advise clients on energy conservation measures.",Construction and Extraction Occupations,47-4099.03,Installateurs et techniciens de la météorisation,"Effectuez une variété d'activités pour résister aux maisons et les rendre plus économes en énergie. Les tâches comprennent la réparation des fenêtres, les conduits isolants et l'exécution du travail de chauffage, de ventilation et de climatisation (CVC). Peut effectuer des audits énergétiques et conseiller les clients sur les mesures de conservation de l'énergie.",Occupations de construction et d'extraction
