Title,Job Zone,Description,Domain,O*NET-SOC Code,french_title,french_description,french_domain
Chief Executives,5,"Determine and formulate policies and provide overall direction of companies or private and public sector organizations within guidelines set up by a board of directors or similar governing body. Plan, direct, or coordinate operational activities at the highest level of management with the help of subordinate executives and staff managers.",Management Occupations,11-1011.00,Dirigeants,"Déterminer et formuler des politiques et fournir l'orientation globale des entreprises ou des organisations du secteur privé et publique dans les directives établies par un conseil d'administration ou un organe directeur similaire. Planifier, directement ou coordonner les activités opérationnelles au plus haut niveau de gestion à l'aide de cadres subordonnés et de gestionnaires du personnel.",Professions de gestion
Chief Sustainability Officers,5,"Communicate and coordinate with management, shareholders, customers, and employees to address sustainability issues. Enact or oversee a corporate sustainability strategy.",Management Occupations,11-1011.03,Chefs de la durabilité,"Communiquez et coordonnez avec la direction, les actionnaires, les clients et les employés pour résoudre les problèmes de durabilité. Adopter ou superviser une stratégie de durabilité de l'entreprise.",Professions de gestion
General and Operations Managers,4,"Plan, direct, or coordinate the operations of public or private sector organizations, overseeing multiple departments or locations. Duties and responsibilities include formulating policies, managing daily operations, and planning the use of materials and human resources, but are too diverse and general in nature to be classified in any one functional area of management or administration, such as personnel, purchasing, or administrative services. Usually manage through subordinate supervisors. Excludes First-Line Supervisors.",Management Occupations,11-1021.00,Général et gestionnaires des opérations,"Planifier, diriger ou coordonner les opérations d'organisations du secteur public ou privé, supervisant plusieurs départements ou emplacements. Les tâches et les responsabilités comprennent la formulation de politiques, la gestion des opérations quotidiennes et la planification de l'utilisation des matériaux et des ressources humaines, mais sont de nature trop diversifiée et générale pour être classée dans un domaine fonctionnel de gestion ou d'administration, comme le personnel, l'achat ou l'administration prestations de service. Gérer généralement par le biais de superviseurs subordonnés. Exclut les superviseurs de première ligne.",Professions de gestion
Legislators,4,"Develop, introduce, or enact laws and statutes at the local, tribal, state, or federal level. Includes only workers in elected positions.",Management Occupations,11-1031.00,Législateurs,"Développer, introduire ou promulguer des lois et des statuts au niveau local, tribal, étatique ou fédéral. Ne comprend que les travailleurs dans des postes élus.",Professions de gestion
Advertising and Promotions Managers,4,"Plan, direct, or coordinate advertising policies and programs or produce collateral materials, such as posters, contests, coupons, or giveaways, to create extra interest in the purchase of a product or service for a department, an entire organization, or on an account basis.",Management Occupations,11-2011.00,Gestionnaires de la publicité et des promotions,"Planifier, directement ou coordonner les politiques et programmes publicitaires ou produire du matériel de garantie, tels que des affiches, des concours, des coupons ou des cadeaux, pour créer un intérêt supplémentaire pour l'achat d'un produit ou d'un service pour un département, une organisation entière ou sur un compte base.",Professions de gestion
Marketing Managers,4,"Plan, direct, or coordinate marketing policies and programs, such as determining the demand for products and services offered by a firm and its competitors, and identify potential customers. Develop pricing strategies with the goal of maximizing the firm's profits or share of the market while ensuring the firm's customers are satisfied. Oversee product development or monitor trends that indicate the need for new products and services.",Management Occupations,11-2021.00,Chefs de marketing,"Planifier, directement ou coordonner les politiques et programmes de marketing, tels que la détermination de la demande de produits et services offerts par une entreprise et ses concurrents, et d'identifier les clients potentiels. Développer des stratégies de tarification dans le but de maximiser les bénéfices de l'entreprise ou la part du marché tout en veillant à ce que les clients de l'entreprise soient satisfaits. Superviser le développement de produits ou surveiller les tendances qui indiquent la nécessité de nouveaux produits et services.",Professions de gestion
Sales Managers,4,"Plan, direct, or coordinate the actual distribution or movement of a product or service to the customer. Coordinate sales distribution by establishing sales territories, quotas, and goals and establish training programs for sales representatives. Analyze sales statistics gathered by staff to determine sales potential and inventory requirements and monitor the preferences of customers.",Management Occupations,11-2022.00,Directeurs commerciaux,"Planifier, diriger ou coordonner la distribution ou le mouvement réel d'un produit ou d'un service au client. Coordonner la distribution des ventes en établissant des territoires de vente, des quotas et des objectifs et établir des programmes de formation pour les représentants des ventes. Analyser les statistiques de vente recueillies par le personnel pour déterminer les exigences du potentiel de vente et des stocks et surveiller les préférences des clients.",Professions de gestion
Public Relations Managers,4,"Plan, direct, or coordinate activities designed to create or maintain a favorable public image or raise issue awareness for their organization or client.",Management Occupations,11-2032.00,Gestionnaires des relations publiques,"Planifier, directement ou coordonner les activités conçues pour créer ou maintenir une image publique favorable ou sensibiliser les problèmes à leur organisation ou client.",Professions de gestion
Fundraising Managers,4,"Plan, direct, or coordinate activities to solicit and maintain funds for special projects or nonprofit organizations.",Management Occupations,11-2033.00,Gestionnaires de collecte de fonds,"Planifier, directement ou coordonner les activités pour solliciter et maintenir des fonds pour des projets spéciaux ou des organisations à but non lucratif.",Professions de gestion
Administrative Services Managers,3,"Plan, direct, or coordinate one or more administrative services of an organization, such as records and information management, mail distribution, and other office support services.",Management Occupations,11-3012.00,Gestionnaires de services administratifs,"Planifier, directement ou coordonner un ou plusieurs services administratifs d'une organisation, tels que les enregistrements et la gestion de l'information, la distribution du courrier et d'autres services de soutien aux bureaux.",Professions de gestion
Facilities Managers,3,"Plan, direct, or coordinate operations and functionalities of facilities and buildings. May include surrounding grounds or multiple facilities of an organization's campus.",Management Occupations,11-3013.00,Gestionnaires des installations,"Planifier, directement ou coordonner les opérations et les fonctionnalités des installations et des bâtiments. Peut inclure des terrains environnants ou plusieurs installations du campus d'une organisation.",Professions de gestion
Security Managers,4,"Direct an organization's security functions, including physical security and safety of employees and facilities.",Management Occupations,11-3013.01,Gestionnaires de sécurité,"Diriger les fonctions de sécurité d'une organisation, y compris la sécurité physique et la sécurité des employés et des installations.",Professions de gestion
Computer and Information Systems Managers,4,"Plan, direct, or coordinate activities in such fields as electronic data processing, information systems, systems analysis, and computer programming.",Management Occupations,11-3021.00,Gestionnaires de systèmes informatiques et d'information,"Planifier, directement ou coordonner les activités dans des domaines tels que le traitement électronique des données, les systèmes d'information, l'analyse des systèmes et la programmation informatique.",Professions de gestion
Financial Managers,4,"Plan, direct, or coordinate accounting, investing, banking, insurance, securities, and other financial activities of a branch, office, or department of an establishment.",Management Occupations,11-3031.00,Gestionnaires financiers,"Planifier, directement ou coordonner la comptabilité, l'investissement, la banque, l'assurance, les titres et d'autres activités financières d'une succursale, d'un bureau ou d'un département d'un établissement.",Professions de gestion
Treasurers and Controllers,4,"Direct financial activities, such as planning, procurement, and investments for all or part of an organization.",Management Occupations,11-3031.01,Trésoriers et contrôleurs,"Activités financières directes, telles que la planification, l'approvisionnement et les investissements pour tout ou partie d'une organisation.",Professions de gestion
Investment Fund Managers,5,"Plan, direct, or coordinate investment strategy or operations for a large pool of liquid assets supplied by institutional investors or individual investors.",Management Occupations,11-3031.03,Gestionnaires de fonds d'investissement,"Planifier, directement ou coordonner la stratégie d'investissement ou les opérations pour un grand pool d'actifs liquides fournis par les investisseurs institutionnels ou les investisseurs individuels.",Professions de gestion
Industrial Production Managers,4,"Plan, direct, or coordinate the work activities and resources necessary for manufacturing products in accordance with cost, quality, and quantity specifications.",Management Occupations,11-3051.00,Chefs de production industrielle,"Planifier, diriger ou coordonner les activités de travail et les ressources nécessaires à la fabrication de produits conformément aux spécifications du coût, de la qualité et de la quantité.",Professions de gestion
Quality Control Systems Managers,4,"Plan, direct, or coordinate quality assurance programs. Formulate quality control policies and control quality of laboratory and production efforts.",Management Occupations,11-3051.01,Gestionnaires de systèmes de contrôle de la qualité,"Planifier, directement ou coordonner les programmes d'assurance qualité. Formuler des politiques de contrôle de la qualité et la qualité du contrôle des efforts de laboratoire et de production.",Professions de gestion
Geothermal Production Managers,3,Manage operations at geothermal power generation facilities. Maintain and monitor geothermal plant equipment for efficient and safe plant operations.,Management Occupations,11-3051.02,Geothermal Production Managers,Gérer les opérations dans les installations de production d'électricité géothermique. Maintenir et surveiller l'équipement de l'usine géothermique pour des opérations de plantes efficaces et sûres.,Professions de gestion
Biofuels Production Managers,4,"Manage biofuels production and plant operations. Collect and process information on plant production and performance, diagnose problems, and design corrective procedures.",Management Occupations,11-3051.03,Biofuels Gestionnaires,"Gérer la production de biocarburants et les opérations de l'usine. Collecter et traiter les informations sur la production et les performances des usines, diagnostiquer les problèmes et concevoir des procédures correctives.",Professions de gestion
Biomass Power Plant Managers,4,"Manage operations at biomass power generation facilities. Direct work activities at plant, including supervision of operations and maintenance staff.",Management Occupations,11-3051.04,Gestionnaires de centrales électriques de biomasse,"Gérer les opérations dans les installations de production d'électricité de biomasse. Activités de travail directes à l'usine, y compris la supervision du personnel des opérations et de la maintenance.",Professions de gestion
Hydroelectric Production Managers,3,Manage operations at hydroelectric power generation facilities. Maintain and monitor hydroelectric plant equipment for efficient and safe plant operations.,Management Occupations,11-3051.06,Gestionnaires de production hydroélectrique,Gérer les opérations dans les installations de production d'électricité hydroélectrique. Maintenir et surveiller l'équipement des usines hydroélectriques pour des opérations de plantes efficaces et sûres.,Professions de gestion
Purchasing Managers,4,"Plan, direct, or coordinate the activities of buyers, purchasing officers, and related workers involved in purchasing materials, products, and services. Includes wholesale or retail trade merchandising managers and procurement managers.",Management Occupations,11-3061.00,Directeurs d'achats,"Planifier, diriger ou coordonner les activités des acheteurs, des agents d'achat et des travailleurs connexes impliqués dans l'achat de matériaux, de produits et de services. Comprend des gestionnaires de marchandisage et des gestionnaires d'approvisionnement en gros ou au détail.",Professions de gestion
"Transportation, Storage, and Distribution Managers",4,"Plan, direct, or coordinate transportation, storage, or distribution activities in accordance with organizational policies and applicable government laws or regulations. Includes logistics managers.",Management Occupations,11-3071.00,"Gestionnaires de transport, de stockage et de distribution","Planifier, directement ou coordonner les activités de transport, de stockage ou de distribution conformément aux politiques organisationnelles et aux lois ou réglementations du gouvernement applicables. Comprend les gestionnaires de logistique.",Professions de gestion
Supply Chain Managers,4,"Direct or coordinate production, purchasing, warehousing, distribution, or financial forecasting services or activities to limit costs and improve accuracy, customer service, or safety. Examine existing procedures or opportunities for streamlining activities to meet product distribution needs. Direct the movement, storage, or processing of inventory.",Management Occupations,11-3071.04,Gestionnaires de la chaîne d'approvisionnement,"Production directe ou coordonnée, achat, entreposage, distribution ou services ou activités de prévision financière pour limiter les coûts et améliorer l'exactitude, le service à la clientèle ou la sécurité. Examinez les procédures existantes ou les opportunités de rationalisation des activités pour répondre aux besoins de distribution de produits. Diriger le mouvement, le stockage ou le traitement des stocks.",Professions de gestion
Compensation and Benefits Managers,4,"Plan, direct, or coordinate compensation and benefits activities of an organization.",Management Occupations,11-3111.00,Gestionnaires de rémunération et d'avantages sociaux,"Planifier, directement ou coordonner les activités de rémunération et d'avantages sociaux d'une organisation.",Professions de gestion
Human Resources Managers,4,"Plan, direct, or coordinate human resources activities and staff of an organization.",Management Occupations,11-3121.00,Gestionnaires des ressources humaines,"Planifier, diriger ou coordonner les activités des ressources humaines et le personnel d'une organisation.",Professions de gestion
Training and Development Managers,4,"Plan, direct, or coordinate the training and development activities and staff of an organization.",Management Occupations,11-3131.00,Gestionnaires de formation et de développement,"Planifier, diriger ou coordonner les activités de formation et de développement et le personnel d'une organisation.",Professions de gestion
"Farmers, Ranchers, and Other Agricultural Managers",4,"Plan, direct, or coordinate the management or operation of farms, ranches, greenhouses, aquacultural operations, nurseries, timber tracts, or other agricultural establishments. May hire, train, and supervise farm workers or contract for services to carry out the day-to-day activities of the managed operation. May engage in or supervise planting, cultivating, harvesting, and financial and marketing activities.",Management Occupations,11-9013.00,"Agriculteurs, éleveurs et autres gestionnaires agricoles","Planifier, diriger ou coordonner la gestion ou l'exploitation des fermes, des ranchs, des serres, des opérations aquacales, des pépinières, des voies de bois ou d'autres établissements agricoles. Peut embaucher, former et superviser les travailleurs agricoles ou contracter des services pour mener les activités quotidiennes de l'opération gérée. Peut s'engager ou superviser les activités de plantation, de culture, de récolte et de financière et de commercialisation.",Professions de gestion
Construction Managers,4,"Plan, direct, or coordinate, usually through subordinate supervisory personnel, activities concerned with the construction and maintenance of structures, facilities, and systems. Participate in the conceptual development of a construction project and oversee its organization, scheduling, budgeting, and implementation. Includes managers in specialized construction fields, such as carpentry or plumbing.",Management Occupations,11-9021.00,Chefs de construction,"Planifier, directement ou coordonner, généralement par le biais du personnel de supervision subordonné, des activités concernées par la construction et l'entretien des structures, des installations et des systèmes. Participer au développement conceptuel d'un projet de construction et superviser son organisation, la planification, la budgétisation et la mise en œuvre. Comprend des gestionnaires dans des champs de construction spécialisés, tels que la menuiserie ou la plomberie.",Professions de gestion
"Education and Childcare Administrators, Preschool and Daycare",4,"Plan, direct, or coordinate academic or nonacademic activities of preschools or childcare centers and programs, including before- and after-school care.",Management Occupations,11-9031.00,"Administrateurs d'éducation et de garde d'enfants, préscolaire et garderie","Planifier, directement ou coordonner les activités académiques ou non académiques des écoles maternelles ou des services et programmes de garde d'enfants, y compris les soins avant et après l'école.",Professions de gestion
"Education Administrators, Kindergarten through Secondary",5,"Plan, direct, or coordinate the academic, administrative, or auxiliary activities of kindergarten, elementary, or secondary schools.",Management Occupations,11-9032.00,"Administrateurs de l'éducation, jardin d'enfants à travers le secondaire","Planifier, diriger ou coordonner les activités académiques, administratives ou auxiliaires des écoles de la maternelle, du primaire ou du secondaire.",Professions de gestion
"Education Administrators, Postsecondary",5,"Plan, direct, or coordinate student instruction, administration, and services, as well as other research and educational activities, at postsecondary institutions, including universities, colleges, and junior and community colleges.",Management Occupations,11-9033.00,"Administrateurs de l'éducation, postsecondaire","Planifier, diriger ou coordonner l'enseignement des étudiants, l'administration et les services, ainsi que d'autres activités de recherche et éducatifs, dans des établissements postsecondaires, y compris des universités, des collèges et des collèges juniors et communautaires.",Professions de gestion
Architectural and Engineering Managers,5,"Plan, direct, or coordinate activities in such fields as architecture and engineering or research and development in these fields.",Management Occupations,11-9041.00,Gestionnaires d'architecture et d'ingénierie,"Planifier, directement ou coordonner les activités dans des domaines tels que l'architecture et l'ingénierie ou la recherche et le développement dans ces domaines.",Professions de gestion
Biofuels/Biodiesel Technology and Product Development Managers,4,"Define, plan, or execute biofuels/biodiesel research programs that evaluate alternative feedstock and process technologies with near-term commercial potential.",Management Occupations,11-9041.01,Biofuels / Technologie du biodiesel et gestionnaires de développement de produits,"Définissez, planifiez ou exécutez des programmes de recherche de biocarburants / biodiesel qui évaluent des technologies de matières premières et de processus alternatives avec un potentiel commercial à court terme.",Professions de gestion
Food Service Managers,2,"Plan, direct, or coordinate activities of an organization or department that serves food and beverages.",Management Occupations,11-9051.00,Gestionnaires des services alimentaires,"Planifier, directement ou coordonner les activités d'une organisation ou d'un département qui sert de la nourriture et des boissons.",Professions de gestion
Gambling Managers,3,"Plan, direct, or coordinate gambling operations in a casino. May formulate house rules.",Management Occupations,11-9071.00,Gestionnaires de jeux,"Planifier, directement ou coordonner les opérations de jeu dans un casino. Peut formuler des règles de la maison.",Professions de gestion
"Entertainment and Recreation Managers, Except Gambling",4,"Plan, direct, or coordinate entertainment and recreational activities and operations of a recreational facility, including cruise ships and parks.",Management Occupations,11-9072.00,"Divertissement et responsables récréatifs, sauf le jeu","Planifier, directement ou coordonner les activités de divertissement et de loisirs et les opérations d'une installation récréative, y compris des navires de croisière et des parcs.",Professions de gestion
Lodging Managers,4,"Plan, direct, or coordinate activities of an organization or department that provides lodging and other accommodations.",Management Occupations,11-9081.00,Responsables de l'hébergement,"Planifier, directement ou coordonner les activités d'une organisation ou d'un département qui fournit un hébergement et d'autres logements.",Professions de gestion
Medical and Health Services Managers,4,"Plan, direct, or coordinate medical and health services in hospitals, clinics, managed care organizations, public health agencies, or similar organizations.",Management Occupations,11-9111.00,Gestionnaires des services médicaux et de santé,"Planifier, directement ou coordonner les services médicaux et de santé dans les hôpitaux, les cliniques, les organisations de soins gérées, les agences de santé publique ou les organisations similaires.",Professions de gestion
Natural Sciences Managers,5,"Plan, direct, or coordinate activities in such fields as life sciences, physical sciences, mathematics, statistics, and research and development in these fields.",Management Occupations,11-9121.00,Gestionnaires des sciences naturelles,"Planifier, directement ou coordonner les activités dans des domaines tels que les sciences de la vie, les sciences physiques, les mathématiques, les statistiques et la recherche et le développement dans ces domaines.",Professions de gestion
Clinical Research Coordinators,4,"Plan, direct, or coordinate clinical research projects. Direct the activities of workers engaged in clinical research projects to ensure compliance with protocols and overall clinical objectives. May evaluate and analyze clinical data.",Management Occupations,11-9121.01,Coordinateurs de la recherche clinique,"Planifier, directement ou coordonner les projets de recherche clinique. Diriger les activités des travailleurs engagés dans des projets de recherche clinique pour assurer la conformité aux protocoles et aux objectifs cliniques globaux. Peut évaluer et analyser les données cliniques.",Professions de gestion
Water Resource Specialists,4,"Design or implement programs and strategies related to water resource issues such as supply, quality, and regulatory compliance issues.",Management Occupations,11-9121.02,Spécialistes des ressources en eau,"Concevoir ou mettre en œuvre des programmes et des stratégies liés aux problèmes de ressources en eau tels que les problèmes d'approvisionnement, de qualité et de conformité réglementaire.",Professions de gestion
Postmasters and Mail Superintendents,2,"Plan, direct, or coordinate operational, administrative, management, and support services of a U.S. post office; or coordinate activities of workers engaged in postal and related work in assigned post office.",Management Occupations,11-9131.00,Postmasters et surintendants du courrier,"Planifier, directement ou coordonner les services opérationnels, administratifs, de gestion et de soutien d'un bureau de poste américain; ou coordonner les activités des travailleurs engagés dans des travaux postaux et connexes dans le bureau de poste assigné.",Professions de gestion
