Title,Job Zone,Description,Domain,O*NET-SOC Code,french_title,french_description,french_domain
Foresters,4,"Manage public and private forested lands for economic, recreational, and conservation purposes. May inventory the type, amount, and location of standing timber, appraise the timber's worth, negotiate the purchase, and draw up contracts for procurement. May determine how to conserve wildlife habitats, creek beds, water quality, and soil stability, and how best to comply with environmental regulations. May devise plans for planting and growing new trees, monitor trees for healthy growth, and determine optimal harvesting schedules.","Life, Physical, and Social Science Occupations",19-1032.00,Forestiers,"Gérer les terres boisées publiques et privées à des fins économiques, récréatives et de conservation. Peut inventaire le type, le montant et l'emplacement du bois debout, évaluer la valeur du bois, négocier l'achat et établir des contrats pour les achats. Peut déterminer comment conserver les habitats de la faune, les lits des ruisseaux, la qualité de l'eau et la stabilité du sol, et comment se conformer au mieux aux réglementations environnementales. Peut élaborer des plans pour planter et cultiver de nouveaux arbres, surveiller les arbres pour une croissance saine et déterminer les horaires de récolte optimaux.","Occupations de la vie, des sciences physiques et sociales"
Epidemiologists,5,"Investigate and describe the determinants and distribution of disease, disability, or health outcomes. May develop the means for prevention and control.","Life, Physical, and Social Science Occupations",19-1041.00,Épidémiologistes,"Étudiez et décrivez les déterminants et la distribution des maladies, de l'invalidité ou des résultats pour la santé. Peut développer les moyens de prévention et de contrôle.","Occupations de la vie, des sciences physiques et sociales"
"Medical Scientists, Except Epidemiologists",5,"Conduct research dealing with the understanding of human diseases and the improvement of human health. Engage in clinical investigation, research and development, or other related activities.","Life, Physical, and Social Science Occupations",19-1042.00,"Scientifiques médicaux, à l'exception des épidémiologistes","Mener des recherches traitant de la compréhension des maladies humaines et de l'amélioration de la santé humaine. S'engager dans une étude clinique, de la recherche et du développement ou d'autres activités connexes.","Occupations de la vie, des sciences physiques et sociales"
Astronomers,5,"Observe, research, and interpret astronomical phenomena to increase basic knowledge or apply such information to practical problems.","Life, Physical, and Social Science Occupations",19-2011.00,Astronomes,"Observer, rechercher et interpréter les phénomènes astronomiques pour augmenter les connaissances de base ou appliquer ces informations à des problèmes pratiques.","Occupations de la vie, des sciences physiques et sociales"
Physicists,5,"Conduct research into physical phenomena, develop theories on the basis of observation and experiments, and devise methods to apply physical laws and theories.","Life, Physical, and Social Science Occupations",19-2012.00,Physicienne,"Effectuer des recherches sur les phénomènes physiques, développer des théories sur la base de l'observation et des expériences et concevoir des méthodes pour appliquer les lois physiques et les théories.","Occupations de la vie, des sciences physiques et sociales"
Atmospheric and Space Scientists,4,"Investigate atmospheric phenomena and interpret meteorological data, gathered by surface and air stations, satellites, and radar to prepare reports and forecasts for public and other uses. Includes weather analysts and forecasters whose functions require the detailed knowledge of meteorology.","Life, Physical, and Social Science Occupations",19-2021.00,Scientifiques de l'atmosphère et de l'espace,"Étudier les phénomènes atmosphériques et interpréter les données météorologiques, recueillies par les stations de surface et aériennes, les satellites et le radar pour préparer des rapports et des prévisions pour les utilisations publiques et autres. Comprend les analystes météorologiques et les prévisionnistes dont les fonctions nécessitent la connaissance détaillée de la météorologie.","Occupations de la vie, des sciences physiques et sociales"
Chemists,4,Conduct qualitative and quantitative chemical analyses or experiments in laboratories for quality or process control or to develop new products or knowledge.,"Life, Physical, and Social Science Occupations",19-2031.00,Chimiste,Effectuer des analyses chimiques qualitatives et quantitatives ou des expériences dans des laboratoires pour le contrôle de la qualité ou des processus ou pour développer de nouveaux produits ou connaissances.,"Occupations de la vie, des sciences physiques et sociales"
Materials Scientists,5,"Research and study the structures and chemical properties of various natural and synthetic or composite materials, including metals, alloys, rubber, ceramics, semiconductors, polymers, and glass. Determine ways to strengthen or combine materials or develop new materials with new or specific properties for use in a variety of products and applications. Includes glass scientists, ceramic scientists, metallurgical scientists, and polymer scientists.","Life, Physical, and Social Science Occupations",19-2032.00,Scientifiques des matériaux,"Recherchez et étudiez les structures et les propriétés chimiques de divers matériaux naturels et synthétiques ou composites, y compris les métaux, les alliages, le caoutchouc, la céramique, les semi-conducteurs, les polymères et le verre. Déterminez les moyens de renforcer ou de combiner des matériaux ou de développer de nouveaux matériaux avec des propriétés nouvelles ou spécifiques à utiliser dans une variété de produits et d'applications. Comprend des scientifiques en verre, des scientifiques en céramique, des scientifiques métallurgiques et des scientifiques des polymères.","Occupations de la vie, des sciences physiques et sociales"
"Environmental Scientists and Specialists, Including Health",4,"Conduct research or perform investigation for the purpose of identifying, abating, or eliminating sources of pollutants or hazards that affect either the environment or public health. Using knowledge of various scientific disciplines, may collect, synthesize, study, report, and recommend action based on data derived from measurements or observations of air, food, soil, water, and other sources.","Life, Physical, and Social Science Occupations",19-2041.00,"Scientifiques de l'environnement et spécialistes, y compris la santé","Effectuer des recherches ou effectuer une enquête dans le but d'identifier, de réduire ou d'éliminer les sources de polluants ou de dangers qui affectent soit l'environnement ou la santé publique. L'utilisation de la connaissance de diverses disciplines scientifiques peut collecter, synthétiser, étudier, signaler et recommander une action basée sur des données dérivées de mesures ou d'observations de l'air, de la nourriture, du sol, de l'eau et d'autres sources.","Occupations de la vie, des sciences physiques et sociales"
Climate Change Policy Analysts,5,"Research and analyze policy developments related to climate change. Make climate-related recommendations for actions such as legislation, awareness campaigns, or fundraising approaches.","Life, Physical, and Social Science Occupations",19-2041.01,Analystes de la politique du changement climatique,"Rechercher et analyser les développements politiques liés au changement climatique. Faites des recommandations liées au climat pour des actions telles que la législation, les campagnes de sensibilisation ou les approches de collecte de fonds.","Occupations de la vie, des sciences physiques et sociales"
Environmental Restoration Planners,5,"Collaborate with field and biology staff to oversee the implementation of restoration projects and to develop new products. Process and synthesize complex scientific data into practical strategies for restoration, monitoring or management.","Life, Physical, and Social Science Occupations",19-2041.02,Planificateurs de restauration environnementale,"Collaborez avec le personnel de terrain et de biologie pour superviser la mise en œuvre de projets de restauration et développer de nouveaux produits. Processus et synthétiser des données scientifiques complexes dans des stratégies pratiques de restauration, de surveillance ou de gestion.","Occupations de la vie, des sciences physiques et sociales"
Industrial Ecologists,5,Apply principles and processes of natural ecosystems to develop models for efficient industrial systems. Use knowledge from the physical and social sciences to maximize effective use of natural resources in the production and use of goods and services. Examine societal issues and their relationship with both technical systems and the environment.,"Life, Physical, and Social Science Occupations",19-2041.03,Écologistes industriels,Appliquer les principes et les processus d'écosystèmes naturels pour développer des modèles pour des systèmes industriels efficaces. Utilisez les connaissances des sciences physiques et sociales pour maximiser l'utilisation efficace des ressources naturelles dans la production et l'utilisation des biens et services. Examinez les problèmes sociétaux et leur relation avec les systèmes techniques et l'environnement.,"Occupations de la vie, des sciences physiques et sociales"
"Geoscientists, Except Hydrologists and Geographers",5,"Study the composition, structure, and other physical aspects of the Earth. May use geological, physics, and mathematics knowledge in exploration for oil, gas, minerals, or underground water; or in waste disposal, land reclamation, or other environmental problems. May study the Earth's internal composition, atmospheres, and oceans, and its magnetic, electrical, and gravitational forces. Includes mineralogists, paleontologists, stratigraphers, geodesists, and seismologists.","Life, Physical, and Social Science Occupations",19-2042.00,"Géoscientifiques, à l'exception des hydrologues et des géographes","Étudiez la composition, la structure et d'autres aspects physiques de la terre. Peut utiliser les connaissances géologiques, physiques et mathématiques en exploration pour le pétrole, le gaz, les minéraux ou l'eau souterraine; ou dans l'élimination des déchets, la remise en état des terres ou d'autres problèmes environnementaux. Peut étudier la composition interne de la Terre, les atmosphères et les océans de la Terre, ainsi que ses forces magnétiques, électriques et gravitationnelles. Comprend des minéralogistes, des paléontologues, des stratigraphes, des géodéistes et des sismologues.","Occupations de la vie, des sciences physiques et sociales"
Hydrologists,5,"Research the distribution, circulation, and physical properties of underground and surface waters; and study the form and intensity of precipitation and its rate of infiltration into the soil, movement through the earth, and return to the ocean and atmosphere.","Life, Physical, and Social Science Occupations",19-2043.00,Hydrologues,"Rechercher la distribution, la circulation et les propriétés physiques des eaux souterraines et de surface; et étudier la forme et l'intensité des précipitations et son taux d'infiltration dans le sol, le mouvement à travers la terre et retournent dans l'océan et l'atmosphère.","Occupations de la vie, des sciences physiques et sociales"
Remote Sensing Scientists and Technologists,5,"Apply remote sensing principles and methods to analyze data and solve problems in areas such as natural resource management, urban planning, or homeland security. May develop new sensor systems, analytical techniques, or new applications for existing systems.","Life, Physical, and Social Science Occupations",19-2099.01,Scientifiques et technologues de télédétection,"Appliquer les principes et les méthodes de télédétection pour analyser les données et résoudre des problèmes dans des domaines tels que la gestion des ressources naturelles, l'urbanisme ou la sécurité intérieure. Peut développer de nouveaux systèmes de capteurs, des techniques analytiques ou de nouvelles applications pour les systèmes existants.","Occupations de la vie, des sciences physiques et sociales"
Economists,5,"Conduct research, prepare reports, or formulate plans to address economic problems related to the production and distribution of goods and services or monetary and fiscal policy. May collect and process economic and statistical data using sampling techniques and econometric methods.","Life, Physical, and Social Science Occupations",19-3011.00,Économistes,"Effectuer des recherches, préparer des rapports ou formuler des plans pour résoudre les problèmes économiques liés à la production et à la distribution de biens et services ou de politique monétaire et fiscale. Peut collecter et traiter les données économiques et statistiques à l'aide de techniques d'échantillonnage et de méthodes économétriques.","Occupations de la vie, des sciences physiques et sociales"
Environmental Economists,5,"Conduct economic analysis related to environmental protection and use of the natural environment, such as water, air, land, and renewable energy resources. Evaluate and quantify benefits, costs, incentives, and impacts of alternative options using economic principles and statistical techniques.","Life, Physical, and Social Science Occupations",19-3011.01,Économistes environnementaux,"Effectuer une analyse économique liée à la protection de l'environnement et à l'utilisation de l'environnement naturel, telles que l'eau, l'air, les terres et les ressources énergétiques renouvelables. Évaluer et quantifier les avantages, les coûts, les incitations et les impacts des options alternatives en utilisant les principes économiques et les techniques statistiques.","Occupations de la vie, des sciences physiques et sociales"
Survey Researchers,5,"Plan, develop, or conduct surveys. May analyze and interpret the meaning of survey data, determine survey objectives, or suggest or test question wording. Includes social scientists who primarily design questionnaires or supervise survey teams.","Life, Physical, and Social Science Occupations",19-3022.00,Chercheurs en sondage,"Planifier, développer ou mener des enquêtes. Peut analyser et interpréter la signification des données d'enquête, déterminer les objectifs d'enquête ou suggérer ou tester le libellé de la question. Comprend les spécialistes des sciences sociales qui conçoivent principalement des questionnaires ou supervisent les équipes d'enquête.","Occupations de la vie, des sciences physiques et sociales"
Industrial-Organizational Psychologists,5,"Apply principles of psychology to human resources, administration, management, sales, and marketing problems. Activities may include policy planning; employee testing and selection, training, and development; and organizational development and analysis. May work with management to organize the work setting to improve worker productivity.","Life, Physical, and Social Science Occupations",19-3032.00,Psychologues industriels-organisationnels,"Appliquez des principes de psychologie aux ressources humaines, à l'administration, à la gestion, aux ventes et aux problèmes de marketing. Les activités peuvent inclure la planification des politiques; tests et sélection, formation et développement des employés; et le développement et l'analyse organisationnelles. Peut travailler avec la direction pour organiser le cadre du travail pour améliorer la productivité des travailleurs.","Occupations de la vie, des sciences physiques et sociales"
Clinical and Counseling Psychologists,5,"Assess, diagnose, and treat mental and emotional disorders of individuals through observation, interview, and psychological tests. Help individuals with distress or maladjustment understand their problems through their knowledge of case history, interviews with patients, and theory. Provide individual or group counseling services to assist individuals in achieving more effective personal, social, educational, and vocational development and adjustment. May design behavior modification programs and consult with medical personnel regarding the best treatment for patients.","Life, Physical, and Social Science Occupations",19-3033.00,Psychologues cliniques et de conseil,"Évaluer, diagnostiquer et traiter les troubles mentaux et émotionnels des individus par l'observation, l'entretien et les tests psychologiques. Aidez les individus à détresse ou à inadapter à comprendre leurs problèmes grâce à leurs connaissances sur les antécédents de cas, les entretiens avec les patients et la théorie. Fournir des services de conseil individuels ou de groupe pour aider les individus à réaliser un développement et un ajustement et d'ajustement plus efficaces. Peut concevoir des programmes de modification du comportement et consulter le personnel médical concernant le meilleur traitement pour les patients.","Occupations de la vie, des sciences physiques et sociales"
School Psychologists,5,"Diagnose and implement individual or schoolwide interventions or strategies to address educational, behavioral, or developmental issues that adversely impact educational functioning in a school. May address student learning and behavioral problems and counsel students or families. May design and implement performance plans, and evaluate performance. May consult with other school-based personnel.","Life, Physical, and Social Science Occupations",19-3034.00,Psychologues scolaires,"Diagnostiquer et mettre en œuvre des interventions ou des stratégies individuelles ou scolaires pour résoudre les problèmes éducatifs, comportementaux ou de développement qui ont un impact négatif sur le fonctionnement éducatif dans une école. Peut résoudre les problèmes d'apprentissage et de comportement des élèves et conseiller les étudiants ou les familles. Peut concevoir et mettre en œuvre des plans de performance et évaluer les performances. Peut consulter un autre personnel en milieu scolaire.","Occupations de la vie, des sciences physiques et sociales"
Neuropsychologists,5,"Apply theories and principles of neuropsychology to evaluate and diagnose disorders of higher cerebral functioning, often in research and medical settings. Study the human brain and the effect of physiological states on human cognition and behavior. May formulate and administer programs of treatment.","Life, Physical, and Social Science Occupations",19-3039.02,Neuropsychologues,"Appliquer les théories et les principes de la neuropsychologie pour évaluer et diagnostiquer les troubles du fonctionnement cérébral plus élevé, souvent dans la recherche et les milieux médicaux. Étudiez le cerveau humain et l'effet des états physiologiques sur la cognition et le comportement humains. Peut formuler et administrer des programmes de traitement.","Occupations de la vie, des sciences physiques et sociales"
Clinical Neuropsychologists,5,"Assess and diagnose patients with neurobehavioral problems related to acquired or developmental disorders of the nervous system, such as neurodegenerative disorders, traumatic brain injury, seizure disorders, and learning disabilities. Recommend treatment after diagnosis, such as therapy, medication, or surgery. Assist with evaluation before and after neurosurgical procedures, such as deep brain stimulation.","Life, Physical, and Social Science Occupations",19-3039.03,Neuropsychologues cliniques,"Évaluer et diagnostiquer les patients présentant des problèmes neuro -haviores liés aux troubles acquis ou au développement du système nerveux, tels que les troubles neurodégénératifs, les lésions cérébrales traumatiques, les troubles de saisie et les troubles d'apprentissage. Recommander le traitement après le diagnostic, comme la thérapie, les médicaments ou la chirurgie. Aider à l'évaluation avant et après les procédures neurochirurgicales, telles que la stimulation cérébrale profonde.","Occupations de la vie, des sciences physiques et sociales"
Sociologists,5,"Study human society and social behavior by examining the groups and social institutions that people form, as well as various social, religious, political, and business organizations. May study the behavior and interaction of groups, trace their origin and growth, and analyze the influence of group activities on individual members.","Life, Physical, and Social Science Occupations",19-3041.00,Sociologues,"Étudiez la société humaine et le comportement social en examinant les groupes et les institutions sociales que les gens forment, ainsi que diverses organisations sociales, religieuses, politiques et commerciales. Peut étudier le comportement et l'interaction des groupes, retracer leur origine et leur croissance et analyser l'influence des activités de groupe sur les membres individuels.","Occupations de la vie, des sciences physiques et sociales"
Urban and Regional Planners,5,"Develop comprehensive plans and programs for use of land and physical facilities of jurisdictions, such as towns, cities, counties, and metropolitan areas.","Life, Physical, and Social Science Occupations",19-3051.00,Planificateurs urbains et régionaux,"Développer des plans et des programmes complets pour l'utilisation des terres et des installations physiques des juridictions, telles que les villes, les villes, les comtés et les zones métropolitaines.","Occupations de la vie, des sciences physiques et sociales"
Anthropologists and Archeologists,5,"Study the origin, development, and behavior of human beings. May study the way of life, language, or physical characteristics of people in various parts of the world. May engage in systematic recovery and examination of material evidence, such as tools or pottery remaining from past human cultures, in order to determine the history, customs, and living habits of earlier civilizations.","Life, Physical, and Social Science Occupations",19-3091.00,Anthropologues et archéologues,"Étudiez l'origine, le développement et le comportement des êtres humains. Peut étudier le mode de vie, la langue ou les caractéristiques physiques des personnes dans diverses parties du monde. Peut s'engager dans la récupération systématique et l'examen des preuves matérielles, telles que les outils ou la poterie restant des cultures humaines passées, afin de déterminer l'histoire, les coutumes et les habitudes de vie des civilisations antérieures.","Occupations de la vie, des sciences physiques et sociales"
Geographers,5,"Study the nature and use of areas of the Earth's surface, relating and interpreting interactions of physical and cultural phenomena. Conduct research on physical aspects of a region, including land forms, climates, soils, plants, and animals, and conduct research on the spatial implications of human activities within a given area, including social characteristics, economic activities, and political organization, as well as researching interdependence between regions at scales ranging from local to global.","Life, Physical, and Social Science Occupations",19-3092.00,Géographes,"Étudiez la nature et l'utilisation des zones de la surface de la Terre, reliant et interprétant les interactions des phénomènes physiques et culturels. Effectuer des recherches sur les aspects physiques d'une région, y compris les formes terrestres, les climats, les sols, les plantes et les animaux, et mener des recherches sur les implications spatiales des activités humaines dans un domaine donné, notamment les caractéristiques sociales, les activités économiques et l'organisation politique, ainsi que En tant que recherche d'interdépendance entre les régions à des échelles allant du local au mondial.","Occupations de la vie, des sciences physiques et sociales"
Historians,5,"Research, analyze, record, and interpret the past as recorded in sources, such as government and institutional records, newspapers and other periodicals, photographs, interviews, films, electronic media, and unpublished manuscripts, such as personal diaries and letters.","Life, Physical, and Social Science Occupations",19-3093.00,Historiens,"Recherchez, analyser, enregistrer et interpréter le passé comme enregistré dans des sources, telles que le gouvernement et les dossiers institutionnels, les journaux et autres périodiques, les photographies, les interviews, les films, les médias électroniques et les manuscrits non publiés, tels que les journaux personnels et les lettres.","Occupations de la vie, des sciences physiques et sociales"
Political Scientists,5,"Study the origin, development, and operation of political systems. May study topics, such as public opinion, political decisionmaking, and ideology. May analyze the structure and operation of governments, as well as various political entities. May conduct public opinion surveys, analyze election results, or analyze public documents.","Life, Physical, and Social Science Occupations",19-3094.00,Politologues,"Étudiez l'origine, le développement et le fonctionnement des systèmes politiques. Peut étudier des sujets, tels que l'opinion publique, la prise de décision politique et l'idéologie. Peut analyser la structure et le fonctionnement des gouvernements, ainsi que diverses entités politiques. Peut effectuer des enquêtes d'opinion publique, analyser les résultats des élections ou analyser des documents publics.","Occupations de la vie, des sciences physiques et sociales"
